id_comentario_anonimizado,comentario,final_misoginia,final_toxicidade,toxicity,severe_toxicity,obscene,identity_attack,insult,threat,sexual_explicit,pred_label,threshold_aplicado
comentario_1980692,"Todo castigo pra essa lacradora ai é pouco, reseta a Km e volta a ser virgem com cirurgia, vai ver alguém quer. 😂😂😂😂",1,1,0.3504168391227722,0.0003435044491197914,0.008094155229628086,0.0015497731510549784,0.21012094616889954,0.02183198370039463,0.002188685815781355,0,0.4
comentario_2648639,Meu deus ele não segue o ante otario né kk.,0,0,0.012608185410499573,6.461512384703383e-05,0.001604050979949534,0.00022464265930466354,0.007895924150943756,0.0003670385340228677,0.00039588866638951004,0,0.4
comentario_1504177,"É verdade,mais estou  nesse dilema. 😮",0,0,0.001302381162531674,0.00010861876216949895,0.0018925645854324102,0.00024123878392856568,0.0012741254176944494,9.907050844049081e-05,8.749240078032017e-05,0,0.4
comentario_2727628,@  eu moro no sul do país e veijo isso acontecer direto,0,0,0.0037818467244505882,0.002156795933842659,0.031022870913147926,0.003487050998955965,0.020397765561938286,0.0011033272603526711,0.0008382345549762249,0,0.4
comentario_2955226,"Tatuagens esquisitas, esse monte de coleira colorida, apreço em demasia pelo dinheiro... tem coisas que são muito óbvias.",0,1,0.21687911450862885,0.00013225631846580654,0.008345255628228188,0.0009129202808253467,0.1781027913093567,0.00025316118262708187,0.0008652831893414259,0,0.4
comentario_2752646,"Boa parte das mulheres que abandonam o marido é por motivos fúteis,  aventuras , promessas e etc....",1,1,0.026571281254291534,8.624991460237652e-05,0.0005156307015568018,0.004865874536335468,0.00783738773316145,0.00018384783470537513,0.0005564138991758227,0,0.4
comentario_1907954,Coitado do miqueinha levando chifre 🤟🫎🫎🫎🤘🤘🤘a muito tempo e não percebeu e vai continuar ser corno,0,1,0.008821292780339718,0.0028815220575779676,0.02575019560754299,0.004093285650014877,0.023158738389611244,0.001489383284933865,0.0009776228107511997,0,0.4
comentario_2048188,Perdoa Mokeinha🤡 ela agiu por impulso🐮,0,1,0.0014844777761027217,0.002176665933802724,0.018607376143336296,0.002787498291581869,0.01382220908999443,0.0010622501140460372,0.0005034536006860435,0,0.4
comentario_917066,"Dia 16 deste mês, fiz 62 anos de casada, um casal dedicado um ao outro, trabalhando juntos por mais de 50 anos, sem brigas e muita parceria.Mas não é mais o normal.",0,0,0.0012502159224823117,4.349181108409539e-05,0.0005518379039131105,0.00010559648944763467,0.00065334711689502,4.72431092930492e-05,0.0002114857197739184,0,0.4
comentario_707095,Deveria ter academia só pra homens e outra só para mulheres,0,0,0.01154679711908102,0.00040755816735327244,0.0011690608225762844,0.006490993779152632,0.0024102928582578897,0.0008300596964545548,0.0016524216625839472,0,0.4
comentario_838162,Só tem duas coisas para tirar esse vazio perdão e Jesus ninguém tampa esse vazio a não ser ele,0,0,0.007013973314315081,3.0280485589173622e-05,0.00022780275321565568,0.0008681166218593717,0.0014302587369456887,0.00012651497672777623,7.484265370294452e-05,0,0.4
comentario_970914,"casa locada , carro locado ou em nome de terceiro comprocuração e cripto hehehe",0,0,0.003446370828896761,6.700675294268876e-05,0.0012806515442207456,0.0002188509242841974,0.002057883655652404,0.0001453654986107722,0.00011684533092193305,0,0.4
comentario_1806647,Ela tá certa em por o filho acima dela .. agora quem quiser segurar esse B.O,0,0,0.03111712448298931,0.0002011930337175727,0.0035250794608145952,0.0002045767178060487,0.002000743756070733,0.010191588662564754,0.00258888048119843,0,0.4
comentario_1234245,Primeiro comentário coerente aqui!,0,0,0.0004906379617750645,7.279593410203233e-05,0.0007002935162745416,0.00016418544691987336,0.0005546686006709933,9.269951260648668e-05,5.770390635007061e-05,0,0.4
comentario_579302,EMPRESA QUE INVESTE NOS FUNCIONÁRIOS DEPOIS JOGA ISSO NA CARA DOS FUNCIONÁRIOS NÃO MERECE SER CHAMADO DE EMPRESA,0,0,0.17381158471107483,0.0019340254366397858,0.03855862468481064,0.0016600847011432052,0.022545665502548218,0.0023088259622454643,0.007277342025190592,0,0.4
comentario_261776,"Um absurdo a lei proteger bandidos, não quer ser exposto é só não roubar.",0,1,0.0984557494521141,2.4806722649373114e-05,0.0008765825186856091,0.00017586391186341643,0.06784619390964508,4.966904452885501e-05,8.334791345987469e-05,0,0.4
comentario_1331384,"Não entendo o que ela fala , blá blá blá blá , a mente  dela funciona assim ?",0,1,0.03374749794602394,2.1233126972219907e-05,0.0005738107720389962,0.00027037886320613325,0.022562865167856216,5.997800326440483e-05,4.93913576065097e-05,0,0.4
comentario_616913,"Ela não abriu igreja , se poupe da ignorância.",0,0,0.9511520266532898,7.964498217916116e-05,0.0006471530650742352,0.006152837537229061,0.9021819829940796,0.00047838277532719076,0.00022216499201022089,1,0.4
comentario_3030363,"eu não duvido que seja verdade, porque um cara ia levar e buscar de moto a sua digníssima esposa que ""trabalhava"" na Vila Mimosa / RJ.  !!!",0,0,0.00461396761238575,6.89529042574577e-05,0.0008463535341434181,0.0002698437310755253,0.0013499683700501919,0.0003131315461359918,0.00045310144196264446,0,0.4
comentario_298435,"Ela fazendo a propaganda da prostituição, só pode.....",1,1,0.5674119591712952,0.0003100971516687423,0.0017328017856925726,0.003396705724298954,0.020206734538078308,0.0036436093505471945,0.1857309192419052,1,0.4
comentario_2994460,"deixa eu adivinhar, a amiga dele mesmo sendo tao incrivel, com 35 anos ta solteira?",0,0,0.027080519124865532,8.329770207637921e-05,0.002874865662306547,0.00044004168012179434,0.015192530117928982,0.00021347396250348538,0.0008509778999723494,0,0.4
comentario_1675680,Kkkkkkkkkkkkkkkkk se a moda pega..Tinha que ser cristão a raiz do mau hoje em dia.,0,1,0.2659641206264496,0.0006241317605599761,0.00477907620370388,0.1818186342716217,0.060687534511089325,0.0012687805574387312,0.0015296974452212453,0,0.4
comentario_1902907,Todo castigo para mangina é pouco !,0,1,0.07014663517475128,0.00013562937965616584,0.0009957264410331845,0.0005594509420916438,0.009041103534400463,0.015724847093224525,0.004001402761787176,0,0.4
comentario_1828966,Kkkkkkkk acho que tu não sai de casa ou mora na europa,0,0,0.3768378496170044,0.0011582451406866312,0.03941144049167633,0.032652296125888824,0.03284124284982681,0.003519280580803752,0.0015028900234028697,0,0.4
comentario_1036321,Parece que alguém surtou a carteira de outrem,0,0,0.006251959595829248,0.00011139923299197108,0.0014783046208322048,0.00045914197107777,0.002938112709671259,0.0006430944777093828,0.0001943936076713726,0,0.4
comentario_325552,Isso é uma coisa que é só de vc.s muito amor com o menino do pibão,0,0,0.3579258918762207,0.0030951250810176134,0.04273146390914917,0.004559782799333334,0.04197872430086136,0.002700748387724161,0.018169797956943512,0,0.4
comentario_1685210,Cara fala bobagem mulher de valor ñ aceita vagabundo não,1,1,0.8234650492668152,0.0003537593293003738,0.006260117515921593,0.015693679451942444,0.7747475504875183,0.0006629140698350966,0.002035497920587659,1,0.4
comentario_912383,Justiça antigamente era só para ricos hoje mudou 😂😂😂 é para ricos e mulheres..Deveria é ser presa e ainda devolver tudo que recebeu indevidamente.,1,1,0.007722223177552223,0.00012133611744502559,0.000677684205584228,0.0017441920936107635,0.0015601952327415347,0.00047994760097935796,0.0007556662894785404,0,0.4
comentario_669603,Isso serve de lição pra os dois lados da moeda ( vice-versa).,0,0,0.0008958178805187345,0.00012796095688827336,0.0012642954243347049,0.00033586236531846225,0.0011788785923272371,0.0002098082477459684,0.00010093129094457254,0,0.4
comentario_2164690,"@  Obs: á única coisa que você nós esclareceu, é o fato de você passar de mão em mão para chegar á essa conclusão, e isso evidência á sua promiscuidade, portanto você não tem valor para relacionamento, hahaha! Sinto lhe dizer, más nós homens preferimos mulheres apertadas e virgens. Portanto você está descartada para nós! Durma com isso.",1,1,0.3164922297000885,0.0006327489973045886,0.011282035149633884,0.01333017647266388,0.1455293446779251,0.002018260769546032,0.017952408641576767,0,0.4
comentario_667323,"E vai aconselhar! Perde a amizade, vai achar que você quer furar o olho",0,0,0.15376348793506622,0.00039733375888317823,0.008798246271908283,0.0002725773665588349,0.02529323101043701,0.030360432341694832,0.0023937979713082314,0,0.4
comentario_1170385,Agora com a gravação  o corno já sabe a catraia kkk,0,1,0.005718126427382231,0.0001465754467062652,0.0032228671479970217,0.00028708772151730955,0.003557093208655715,0.00035173221840523183,0.00034710796899162233,0,0.4
comentario_980477,Mas têm os casos em que o ex é quem faz questão de pagar pensão pra filha da ex que o pai biológico não paga. Terminei o relacionamento com um assim. A ex vivia ligando cobrando algo e ele achava que estava certo. Saí fora! Acho que pagava a pensão pra filha pra continuar tendo acesso à mãe! Ora se não!,0,1,0.0012058848515152931,3.3059728593798354e-05,0.0002556880936026573,0.00010575177293503657,0.0005648383521474898,6.984831998124719e-05,0.0001177044105133973,0,0.4
comentario_1492611,"Ei padrinho, prato cheio pra você, o GADO do Arthur Petri ferrou com um amigo de longa data por causa de birra da mulher.",1,1,0.1886114776134491,0.0004610177129507065,0.013733805157244205,0.0017446279525756836,0.037995219230651855,0.0031616808846592903,0.03169526904821396,0,0.4
comentario_1000097,Ser deus feis porquer cabe kkkk,0,0,0.9893078207969666,0.020660480484366417,0.100707046687603,0.026754925027489662,0.08944481611251831,0.0023733319249004126,0.10878770053386688,1,0.4
comentario_1282667,Mulher assim é só água e pau guerreiro se vc ainda não aprendeu...paciencia,1,1,0.5840961337089539,0.0018163371132686734,0.018674679100513458,0.01881713978946209,0.06674899905920029,0.009714625775814056,0.3969472348690033,1,0.4
comentario_2831753,"Toda vez que uma mulher fala da vida financeira de um homem, sei não hein...",1,1,0.019035734236240387,0.0003479630977381021,0.0015141887124627829,0.005322830751538277,0.003531268797814846,0.0007179121021181345,0.00163747975602746,0,0.4
comentario_1436345,"As igrejas criam as mulheres como umas deusas que como se tudo der errado a culpa é SOMENTE DO HOMEM,  que são santas , muitas vem marcadas do passado promíscua, carregando e jogando isso no peito do homem de igreja, ficaram com muitos homens e mulheres, e te tratam como uma sub- espécie dela sendo que 99% das invenções , construções , criações , sistema excepcionalmente vitais são os homens que fazem e elas só recebem ou pagam pra ter oque um homem fez e acham que trabalhar e pagar pra ter faz dela tá na mente dela ser melhor que todo mundo, as igrejas pregam homem provedor , linha de frente, aí de vc falhar , de Deus, brilhante e cromado no escuro , com cargos de pastores ou de responsabilidade, se não o cara não têm respeito. Eu vi que as igrejas são máquinas de criar feministas com Bíblia debaixo do braço, e elas usam a palavra de Deus te amaldiçoando, más , coração e maus olhos e Cultura, afinal de contas: ela têm que ver qual o melhor ""macho"" que vai facilitar a vida dela e tbm aceita lá sem que ela precise mudar , como a mulher de Jó que pedia pra ele se matar amaldiçoando a Deus e vale lembrar que:  Eva a   mulher antes de cair , cobiçou a árvore do conhecimento e a promessa do diabo foi ela ter poder sobre o homem e Deus e não precisar de ninguém , fez Adão cair , fazendo amizade com o diabo e escondeu isso dele todo tempo, por amor e Eva já queria o divórcio, satanás sugeriu a Eva o feminismo e o homem deu todo seu poder pra ela que estava caída, ela não merecia e isso nem sendo boa , quem dirá caída. E  se repete com homens dando ouvidos a mulher caída com falsas acusações e fazendo leis pra elas e dando até título de eleitor onde na sua maior parte são de esquerdas ou PIORRRRRRRR ,  se comporta como feminista sem saberem que são . O mundo caiu no marianismo onde a mulher é dona da verdade mesmo sendo bandida e mentirosa, a natureza da mulher é pior e mais profana  que a do homem , mas muitos não estão preparados pra essa conversa.",1,1,0.40277916193008423,0.002413055393844843,0.009822321124374866,0.0356830470263958,0.22726203501224518,0.002258020220324397,0.005807777401059866,1,0.4
comentario_1774213,Esse é um grande problema. Levou um ghost do chad e tá perdidinha!!!! Não recebeu atenção se PERDEU TODINHA,1,1,0.6393885016441345,0.001924677286297083,0.13052581250667572,0.0030789740849286318,0.09175046533346176,0.0015341596445068717,0.0018733026226982474,1,0.4
comentario_142519,"chamaram duas mulheres contra o feminismo pra falar de feminismo, não teve contraponto, então não fez sentido algum porque não houve debate antagônico.",0,0,0.010444682091474533,0.00013575721823144704,0.0008924356661736965,0.005214715376496315,0.0028242210391908884,0.0002632147225085646,0.0008691413095220923,0,0.4
comentario_2288686,"O objetivo não é evitar o desamparo das crianças. É gastar menos com auxílios governamentais, terceirizando a lasqueira para os homens.",0,0,0.035234324634075165,0.00018144126806873828,0.0007533269817940891,0.004308366682380438,0.004339422564953566,0.002827397547662258,0.0010215479414910078,0,0.4
comentario_791369,"Quem mora na roça e produz o seu próprio alimento, tem outra vida!",0,0,0.0020362972281873226,3.176360405632295e-05,0.0005574649549089372,9.371354099130258e-05,0.0008358039194718003,9.80337499640882e-05,5.751601929659955e-05,0,0.4
comentario_2923233,Elas próprias são as canalhas. Ficam reclamando porque simplesmente perdem para as mais jovens.,1,1,0.9569940567016602,0.0005328947445377707,0.05872774496674538,0.00385280791670084,0.9374659061431885,0.0011046691797673702,0.004039166960865259,1,0.4
comentario_771457,So pela sobrancelha e pelo cabelo vcs ja sabem ne😂,1,1,0.01581985503435135,0.00016582234820816666,0.0045787254348397255,0.0003558178141247481,0.009297948330640793,0.0004727768828161061,0.002013757359236479,0,0.4
comentario_2052871,Ele tem que escolher a própria companhia. Mgtow forever. Viver a solitude.,0,0,0.000741036084946245,2.8253118216525763e-05,0.0003443236055318266,8.074503421084955e-05,0.0003479159786365926,5.1112827350152656e-05,5.569148561335169e-05,0,0.4
comentario_163134,Essa atriz é muito legal e linda.😊,0,0,0.0046059549786150455,0.0001244040031451732,0.0025782345328480005,0.0005475520738400519,0.002375752665102482,9.635440073907375e-05,0.0004545383562799543,0,0.4
comentario_2228191,Parabéns para todas as mulheres ❤❤❤,0,0,0.012848534621298313,0.00028086494421586394,0.0015773095656186342,0.007369654253125191,0.0027427240274846554,0.0007386660436168313,0.001499866251833737,0,0.4
comentario_2359618,Realidade.....nunca te amou. Só  isso.,0,0,0.004111711401492357,5.43597707292065e-05,0.001330639934167266,0.0002072478091577068,0.0008365596877411008,0.00011632827227003872,0.0001620003895368427,0,0.4
comentario_1829536,"que coisa, parece que as pessoas não estão se achando então kk",0,0,0.031439442187547684,0.00031270403997041285,0.019839942455291748,0.000639582343865186,0.00785624235868454,0.00029111793264746666,0.0004123926046304405,0,0.4
comentario_2480869,"Ei Copini, o povo tem o direito e o dever de se revoltar 👍🏼",0,0,0.04923009127378464,8.438018994638696e-05,0.0029037611093372107,0.00038829908589832485,0.0205709096044302,0.0004977243952453136,0.000536957464646548,0,0.4
comentario_1361913,"Esquerdistas como o Álvaro, defendem o indefensável. Não tem argumentos, só sabem rotular e tentar cancelar os outros. Quando em um debate organizado, saem “cagados e se arrastando”.",0,1,0.17460252344608307,0.00035184051375836134,0.08433273434638977,0.002047537360340357,0.04373405501246452,0.000995020498521626,0.002672218019142747,0,0.4
comentario_1406866,Da mesma turma queremos emagrecer comendo brigadeiro 😅,0,1,0.0018983316840603948,5.0570826715556905e-05,0.0007086009136401117,0.0001612292544450611,0.0006016248953528702,0.00017326306260656565,0.00011815388279501349,0,0.4
comentario_1723569,Esse cara é muito grande super pai❤❤❤❤❤,0,0,0.04965069517493248,0.0008854158222675323,0.01570170372724533,0.0010632642079144716,0.014411910437047482,0.0011253865668550134,0.0038085156120359898,0,0.4
comentario_2912274,"CUMPLICIDADE? Ela: só cuida das crianças. Ele: tem que trabalhar, chegar em casa, limpar toda a bagunça, fazer a comida de todos, e se pá ela ainda trai ele. show de cumplicidade.",0,1,0.14470000565052032,0.00028259633108973503,0.006148850079625845,0.000593639153521508,0.01797059364616871,0.026044193655252457,0.007985898293554783,0,0.4
comentario_1747456,@  Melhor investimento que você faz em se mesmo!,0,0,0.004418546333909035,0.00024335511261597276,0.005896756891161203,0.0003784119908232242,0.004321683198213577,0.00031348850461654365,0.00020914913329761475,0,0.4
comentario_2404501,"  Ué como eu disse, já dei aula de reforço para Debora acima, e também conheço os filhos dos meus primos, eles são de boaça,  se você tornar algo interessante eles querem.Tenho vários ""testes empíricos"" sobre isso. Celular não é impedimento, pois antes dessa geração existia, tv, console de computador e namorico de rua e o vício era o mesmo. Inclusive se sua sobrinha ainda for muito nova, recomendo usar algum app de controle de idade para bloquear o acesso dela a determinados conteúdos, mas vou logo dizendo isso não é solução a longo prazo e vai dar dor de cabeça a curto, mas é efetivo a médio.",0,0,0.0020918885711580515,5.986217729514465e-05,0.0014975258382037282,9.77751478785649e-05,0.0014595661778002977,7.149219163693488e-05,0.00017977910465560853,0,0.4
comentario_1837362,O Claytim procurando o motoca até hoje pra arrebentar a cara dele ....😌,0,1,0.06297185271978378,0.00020039199443999678,0.0017983390716835856,0.00038160281837917864,0.0055077592842280865,0.024282829836010933,0.0019665819127112627,0,0.4
comentario_2917596,"O simbolo maior nessa area é o Gabriel. Ta certo que armaram pra ele mas, ele caiu pela libido.",0,1,0.01855667121708393,0.00010124437540071085,0.00204276479780674,0.00035082033718936145,0.0021957315038889647,0.0005435383063741028,0.0046214633621275425,0,0.4
comentario_41188,"Já pararam pra pensar que a mulher ferra o homem de todos os lados, ferra o sujeito que paga pensão, e ferra o próprio filho que terá que cuidar de 2 pais dependendo do caso na velhice! Já que a paternidade vem com todas as responsabilidades reciprocas para todos os lados",1,1,0.2992899715900421,0.002787390723824501,0.14102540910243988,0.002642751205712557,0.025868795812129974,0.0067173331044614315,0.06726230680942535,0,0.4
comentario_2797022,"Maaaaaano. ""Deu sorte"" Numa dessas, ""a mulher"" se joga no chão, se bate, se joga na porta E VAI DIZER Q FOI AGREDIDA. E um juíz ainda prende, acaba com a vida do traído, SO PELA PALAVRA DO LIXO",1,1,0.16482388973236084,0.00038367731031030416,0.006475777365267277,0.0020261777099221945,0.03895672410726547,0.004915543366223574,0.0064625865779817104,0,0.4
comentario_1272000,"E nós mulheres falamos o mesmo, tem um monte de encostado por aí.",0,0,0.05975738540291786,0.00016688542382325977,0.0017722303746268153,0.0115879587829113,0.018431268632411957,0.0009010496432892978,0.0025123979430645704,0,0.4
comentario_2643100,"Pior que existem esses tipos, lamentável!",0,0,0.27041447162628174,0.00010667363676475361,0.0013327865162864327,0.0010959618957713246,0.23109082877635956,0.0014319692272692919,0.00035144295543432236,0,0.4
comentario_2748544,"É por isso que muitas mulheres querem casar, elas sabem que quando o divórcio chegar, elas ficarão com todos os bens materiais dos homens, deixando a manginada ilidida na bancarrota. Realmente, as mulheres modernas estão completamente insanas , as leis mais insanas ainda. Marriage Strike now !",1,1,0.7038372159004211,0.0011154020903632045,0.005892725195735693,0.18614675104618073,0.565129280090332,0.004246425349265337,0.004531964659690857,1,0.4
comentario_2660926,"Quanto comentário de gente burra. Vcs já viram como funciona a Maria da Penha na verdade? Já viram que o cara aguarda dentro da casa com a mulher? Já pararam pra pesquisar quantas morrem após a denuncia? Cês tem a internet pra buscar informações de qualidade e preferem bostejar. A regra é a msm tanto pro homem quanto pra mulher, vc tem de ter provas, fazer o exame de corpo de delito, o acusado aguarda em liberdade independente de ser homem ou mulher. Nossa é MT burrice, além de que MTS vezes mesmo provado a agressão a única coisa que acontece é o pagamento de uma multa e medida cautelar, mais nada. Vão se informar, Sigma e feminista são uma cambada de idiota destilando ódio ao sexo oposto. Se depender desses dois grupos de babacas os humanos entram em extinção já já, as únicas grávidas vão ser as putas pq Sigma paga de certo mas só gosta de comer vagabunda.",1,1,0.9775453805923462,0.00913076102733612,0.24687831103801727,0.015610935166478157,0.9692782759666443,0.007036559749394655,0.022878259420394897,1,0.4
comentario_567456,"Se isso não for o próprio, é um dos tipos do número da besta que já está dominando a mente da humanidade!",0,1,0.11710061132907867,4.1529950976837426e-05,0.0006126281805336475,0.001404241076670587,0.0840332955121994,0.00011555073433555663,0.00010449792898725718,0,0.4
comentario_973142,".. Muita sabedoria, só tendo Espírito Santo ... para conseguir assimilar tanta Informação de Qualidade ...",0,0,0.0006239485228434205,3.7727328162873164e-05,0.00023916158534120768,0.00014302686031442136,0.0003865478793159127,5.093804429634474e-05,4.353505210019648e-05,0,0.4
comentario_1632720,Eu fui. Então falo com propriedade rs,0,0,0.00147896574344486,0.00048734538722783327,0.007908622734248638,0.0007678409456275403,0.005201301071792841,0.00040728822932578623,0.0003616084868554026,0,0.4
comentario_2264957,Vamos ir terminando com essas traquinagens,0,0,0.06565653532743454,0.0013321057194843888,0.018401367589831352,0.0014321818016469479,0.016605086624622345,0.011109794490039349,0.004203539341688156,0,0.4
comentario_1142680,"@  quem deve estar chorando é você sozinho ,abandonado , eu tô muito bem com meu amor.",0,1,0.22448289394378662,0.0017071268521249294,0.02858681045472622,0.002423363272100687,0.030373025685548782,0.0015448697376996279,0.003991350997239351,0,0.4
comentario_2264243,"Mesmo que o não procurar ela, está preste a chutar ela de casa. Já  o outros amante, depois de alguns anos, vai chutar também. Resumindo: ela vai ficar frustada em tudo.😂",0,1,0.647763729095459,0.0012983857886865735,0.008607303723692894,0.001195692690089345,0.025522420182824135,0.4833971858024597,0.005960746668279171,1,0.4
comentario_2937129,Cada dia q se passa mais triste v no que esses barriga tao se transformando,0,0,0.23338283598423004,0.000412269146181643,0.028603514656424522,0.0017904038541018963,0.17293314635753632,0.001383951399475336,0.0022442322224378586,0,0.4
comentario_659780,"@ , aí vc tá aplicando a *fórmula Alpha 3F*",0,0,0.0008953093783929944,0.00044516194611787796,0.005957950372248888,0.0006886441842652857,0.003917274996638298,0.00027865139418281615,0.00016957915795501322,0,0.4
comentario_1649374,@  Profº Marcelo Andrade é minha sugestão. Homem sério da história e que ensina bastante sobre o catolicimo histórico.,0,0,0.0023951400071382523,0.0005524668376892805,0.0008620013832114637,0.0012696449412032962,0.0011318614706397057,0.000754079723265022,0.0005022562691010535,0,0.4
comentario_2948309,Como o mais velhos falavam todo castigo pra corpo e pouco,0,1,0.02729053609073162,0.0001480459759477526,0.0013204102870076895,0.00033334517502225935,0.004888144321739674,0.004435980226844549,0.0019822800531983376,0,0.4
comentario_2121699,Cada um considera o que seria tradição,0,0,0.0006654783501289785,0.0001704313326627016,0.0019001630134880543,0.00032576516969129443,0.0013861556071788073,0.00015051056107040495,9.03830659808591e-05,0,0.4
comentario_88901,"Kkkk homens achando que mulheres se arrumam para eles. Outra coisa,  pq será eles sempre estão de olho nas que se arrumam.  Que se maqueiam!  Eles preferem as mulheres sem maquiagem pq assim não chamam atenção.",1,1,0.0787367969751358,0.0005181296146474779,0.0019752776715904474,0.038286998867988586,0.007625189144164324,0.0028417191933840513,0.0060160462744534016,0,0.4
comentario_2193688,E os buracos dos dentes dele?😂😂😂😂,0,0,0.015328723005950451,0.00013592625327873975,0.0020788833498954773,0.0003506848879624158,0.00478516286239028,0.0033324756659567356,0.0018851776840165257,0,0.4
comentario_68437,o Marcos eberlin estudou é professor etc...e aí? E você é Oque mesmo?,0,0,0.0029900146182626486,0.00032596400706097484,0.0066038621589541435,0.0007022740901447833,0.007797558326274157,0.0002090259367832914,0.00018058244313579053,0,0.4
comentario_2691461,"Fez muito bem, se continuar ela vai trair de novo!",0,1,0.009803765453398228,7.191970507847145e-05,0.0011451472528278828,0.00020284397760406137,0.0023597460240125656,0.0017338217003270984,0.00037611188599839807,0,0.4
comentario_1175369,"Corrige a fala!!! Minhas inimigas me criticam muito... Invejosas por vc ter um marido maravilhoso, provedor...vc não trabalha fora, trabalha dentro e ainda faz curso...viva sua vida e não ouve as inimigas...e abre seus olhos com elas tbm",1,1,0.058434322476387024,0.00019714648078661412,0.003952836152166128,0.0010667223250493407,0.030122842639684677,0.0008182009914889932,0.0010947327828034759,0,0.4
