id_comentario_anonimizado,comentario,final_misoginia,final_toxicidade,toxicity,severe_toxicity,obscene,identity_attack,insult,threat,sexual_explicit,pred_label,threshold_aplicado
comentario_1865854,"Falou tudo... Depois elas vem falar que sao empoderadas, que conquistaram tudo com seu próprio esforço 😂😂😂",1,1,0.004578455816954374,7.697217370150611e-05,0.0026100222021341324,0.00013862740888725966,0.002582856686785817,8.09130651759915e-05,0.0004028654657304287,0,0.4
comentario_159074,Parabéns  aos dois o patrão que foi solidario e o empregado que cuidou dz fazenda como se fosse dele.Aí vem a vitória.Deus te dá a oportunidade e vc.faz a sua parte para ter a vitória.,0,0,0.0005195123376324773,2.7735723051591776e-05,0.00019820424495264888,6.699538789689541e-05,0.0002300410415045917,4.953045572619885e-05,4.691769936471246e-05,0,0.4
comentario_2952444,"Quando o parceiro diz foda-se pra o outro, já disse tudo.Agora fica quem quiser já que no final o lascado não será eu e sim quem continuo kk😂",0,0,0.8550808429718018,0.004044357221573591,0.1804111897945404,0.0030083246529102325,0.10450946539640427,0.0015071277739480138,0.03434312716126442,1,0.4
comentario_220007,Há muitos casais em que homem e mulher têm a mesma idade e seus casamentos já duram há mais de 30 anos.,0,0,0.0026080342940986156,0.0004839449829887599,0.0011942231794819236,0.0012534669367596507,0.0010603786213323474,0.000555009173694998,0.0010725392494350672,0,0.4
comentario_1409876,"@  sou mulher e acredito que cada um, independente de ser homem ou mulher, deve assumir responsabilidade por suas atitudes. Se ela tem descontrole emocional ela precisa se tratar, não é culpa de ninguém a não ser ela mesma. O racismo faz parte da personalidade dela e de muitos que não são expostos. Ela diz que o relacionamento era abusivo, mas o que ela mostra é, chorando, tentar sensibilizar quem assiste se vitimizando. É evidente que ela está inventando história para se sair de vítima. Mulheres e homens podem ser tóxicos na mesma proporção. Ela é racista e narcisista.",0,1,0.24691641330718994,0.00103793665766716,0.0030641071498394012,0.019353056326508522,0.16098445653915405,0.0012998990714550018,0.002889259485527873,0,0.4
comentario_1794740,"@  quem disse que Kaka foi forte? Pelo contrário, dentro do relacionamento ele era submisso.",0,1,0.0029136380180716515,0.00017561441927682608,0.0035280503798276186,0.0003557371092028916,0.0038556894287467003,0.00019491607963573188,0.00020943609706591815,0,0.4
comentario_1818008,elas quebram regras pro chad... foda kk,0,1,0.9857540130615234,0.012383871711790562,0.21110987663269043,0.006863371469080448,0.08794745802879333,0.0024040660355240107,0.11293427646160126,1,0.4
comentario_616179,Por curiosidade? Porque você nunca namorou?,0,0,0.02731422893702984,0.0007529426948167384,0.013111172243952751,0.00105695566162467,0.00777495326474309,0.0006925013731233776,0.0031514721922576427,0,0.4
comentario_979423,"MUITO  CUIDADO,  VCS TRABALHAM NA MESMA EMPRESA E ELE PODE TE USAR A HORA QUE QUISER. VC É MUITO CARENTE E SUA AUTOESTIMA ESTÁ  MUITO BAIXA. SE CUIDE, POR FAVOR!!",0,1,0.14453205466270447,0.00024904889869503677,0.009889328852295876,0.00027257789042778313,0.053597427904605865,0.00044077238999307156,0.0013544511748477817,0,0.4
comentario_966475,É um acordo que elas tem com o cidade alerta senão eles ficam sem trabalho,0,0,0.002289139200001955,8.841160888550803e-05,0.0012482134625315666,0.0003624355886131525,0.0008036657818593085,0.00021632282005157322,0.00012806862650904804,0,0.4
comentario_2466080,@  Eu achava que você fosse  pouco mais inteligente. Escrita é uma forma de expressão verbal. Agora entendo porque concorda com ela é falta de qi.,0,1,0.047388508915901184,0.00024624975048936903,0.0045250579714775085,0.0006423068116419017,0.06330186128616333,0.00021913113596383482,0.000127252540551126,0,0.4
comentario_642800,"@ japones reclama muito dos mais jovens tb? Imagino que sim, são bem tradicionais. Ta morando em qual cidade? Eu fui de férias lá em 2019 e amei, mas imagino que pra morar a experiência seja outra.",0,0,0.0011108858743682504,5.406972923083231e-05,0.0008741410565562546,0.0002018422819674015,0.0007308448548428714,6.719891825923696e-05,8.226541103795171e-05,0,0.4
comentario_2117441,Ele foi burro demais. Dava pra fazer um relato fod4. Mas nem  todo mundo tem tanto discernimento.,0,1,0.9874958992004395,0.0024055554531514645,0.4668266177177429,0.0017785371746867895,0.8791221380233765,0.0007660328992642462,0.009584339335560799,1,0.4
comentario_1348995,Se fosse o contrário ela ia brigar enxe o saco e fala que homem não presta,1,1,0.0887974426150322,0.0004677284450735897,0.005044262856245041,0.003535976866260171,0.022017834708094597,0.005186732392758131,0.00450671324506402,0,0.4
comentario_2896468,Fiquei sabendo que trezoitão gostaria de conversar com vc de pronto digo que veria .,0,0,0.03555821254849434,0.0005272512207739055,0.010792379267513752,0.0007503357483074069,0.016886644065380096,0.002971522742882371,0.0018063688185065985,0,0.4
comentario_1822779,"Se o caminhão estiver em alta velocidade, não vai adiantar nada, isso é física!",0,0,0.003317213384434581,0.00012164171494077891,0.0021504200994968414,0.00021690255380235612,0.0009494083933532238,0.0004819185705855489,0.00037109735421836376,0,0.4
comentario_983294,"PEGUEI MUITA MULHER VAGABUNDA NA MINHA VIDA.COMI,USEI E REVIREI DO AVESSO,DEPOIS MANDEI ANDAR.MULHER VAGABUNDA SÓ SERVE PRA USAR E DEPOIS LARGAR.PRONTO,FALEI!",1,1,0.12906219065189362,0.0007666905294172466,0.005816969554871321,0.005878415424376726,0.01767042651772499,0.007775627076625824,0.010858149267733097,0,0.4
comentario_2473741,"  E pra quê você acha que uma mulher vai querer um homem egoísta e narcisista assim como você. que não tem nada pra se doar, que não existe entrega, cuidado seu com ela e nem reciprocidade. Não é atoa que ninguém te quer e você está sozinho.",0,1,0.4974234700202942,0.0003761783882509917,0.002804618561640382,0.01304007787257433,0.42985999584198,0.0005637790309265256,0.0018352047773078084,1,0.4
comentario_2488117,Verdade passei por isso 😢É terrível infelizmente.,0,0,0.0026655520778149366,4.3068310333183035e-05,0.001061980496160686,0.0001384055067319423,0.001084555871784687,6.71791858621873e-05,8.240351598942652e-05,0,0.4
comentario_1147792,Ela não daria 10 passos pra ir na casa dele kkkk,0,0,0.005201547872275114,4.35254187323153e-05,0.0009066395577974617,0.0001664950541453436,0.0008940109983086586,0.0003658766217995435,0.0002446453145239502,0,0.4
comentario_359780,"Abaixa o shortinho dele, pega uma cinta e desce-lhe uma cintada... Sem ódio no coração, mas com a certeza de estar educando, ainda em tempo, porque essa reação é de quem não foi educado no tempo correto. Em hipótese alguma poderá prevalecer a raiva, mas sim o amor e a certeza de estar fazendo o melhor para que este não sofra com a correção tardia que talvez já não será mais possível e trará sofrimento para muitos.",0,1,0.16623122990131378,0.0005126266623847187,0.00402911426499486,0.000939554360229522,0.0033193030394613743,0.1517186015844345,0.0033344400580972433,0,0.4
comentario_480177,"Ele pulou uma fogueira de costa, ele se livrou de um grande problema",0,0,0.018887395039200783,0.0001871995918918401,0.008193127810955048,0.0003112134290859103,0.00410026591271162,0.0007785540074110031,0.0010825502686202526,0,0.4
comentario_1717855,"Engraçado ""perdoa pra ficar bem com sigo msm"" quem fica bem é quem é perdoado ou quem perdoa??? Eu estou revendo esse conceito",0,0,0.0020427783019840717,0.00016931354184634984,0.0032958430238068104,0.00024399982066825032,0.0015233641024678946,0.00015964241174515337,0.00024520227452740073,0,0.4
comentario_536396,Debate ou podcast c outros convidados não funciona para o Felipe. Ele tem muito conteúdo mas tem q ser convidado sozinho.,0,0,0.000612281437497586,0.00024478064733557403,0.002611540723592043,0.0004279348358977586,0.0024131713435053825,0.0001606496371096,9.585959924152121e-05,0,0.4
comentario_628190,"Se nem ela se importa com ela, por que o rapaz tem que se importar, vagaba!",1,1,0.4123709499835968,0.0016077834879979491,0.054211512207984924,0.0026808453258126974,0.11083444952964783,0.051816780120134354,0.013117794878780842,1,0.4
comentario_2825113,"O estado é ladrão, ineficiente, inútil e desnecessário. O estado não produz nada e so atrapalha a vida das pessoas.",0,1,0.8981359004974365,7.307106716325507e-05,0.0012020138092339039,0.0010177817894145846,0.8294288516044617,0.00019844456983264536,0.00012309043086133897,1,0.4
comentario_1477541,E nem assim funcionou! Tô passada!,0,0,0.001532976166345179,0.00027713776216842234,0.00496134115383029,0.00041660547140054405,0.0033093413803726435,0.000270705932052806,0.0002207342768087983,0,0.4
comentario_1756032,"1:10:00 concordo plenamente e ja percebo isso mesmo, meu pai não era presente, mas eu vou ser",0,0,0.0016114740865305066,0.004828624427318573,0.03440296649932861,0.005439819302409887,0.03079209476709366,0.0018938927678391337,0.0009908622596412897,0,0.4
comentario_2091352,"Acho que há um tempo mínimo para não correr o risco para anulação, 🤔🤔😂😂😂😂",0,0,0.00044530475861392915,2.376680822635535e-05,0.0001890274725155905,9.238500206265599e-05,0.0002346127002965659,3.0901937861926854e-05,2.1519252186408266e-05,0,0.4
comentario_2108997,Conselho super  saudável!!!  kkkkkkkkkkkkkkkkkkkkkkkkkkkk  imagina os psicólogos  olhando isso!,0,0,0.036036986857652664,0.00034149730345234275,0.021427899599075317,0.000391737325116992,0.010046856477856636,0.00033689787960611284,0.0007760770386084914,0,0.4
comentario_1431760,"Em 2020 eu disse: ''vão todas virar GPs de 30,00"" Falsa acusação para cima de mim, é tomar varias azeitonas facil facil",1,1,0.0044662849977612495,9.92564091575332e-05,0.00208101118914783,0.00020720669999718666,0.0009468776406720281,0.00039819275843910873,0.00033861363772302866,0,0.4
comentario_2506207,Verdade! Alexandre agrega muito ao podcast.,0,0,0.00044016126776114106,9.055664122570306e-05,0.0009990019025281072,0.00016389810480177402,0.0007017505704425275,8.629351214040071e-05,7.227328751469031e-05,0,0.4
comentario_1667440,Isso se o Gustavo não fugir de novo.,0,0,0.000960335077252239,7.185889262473211e-05,0.000714243040420115,0.00017052511975634843,0.0006259952206164598,0.00017083938291762024,6.604124791920185e-05,0,0.4
comentario_2905663,O palito queimado quer voltar pra caixinha de fósforos...,0,0,0.051500461995601654,7.244034350151196e-05,0.0018037792760878801,0.0002340170758543536,0.024955378845334053,0.0010857793968170881,0.0008308545802719891,0,0.4
comentario_506479,Cabou o dinheiro a mina some😂😂😂😂,1,1,0.004890654236078262,0.00011072694178437814,0.0030468746554106474,0.0002975820389110595,0.0014551266795024276,0.0003056646673940122,0.0001961867674253881,0,0.4
comentario_675396,Passar o dia inteiro jogando video game no meu pc...,0,0,0.002780113136395812,0.0001888462429633364,0.002835696330294013,0.00041988235898315907,0.0010245381854474545,0.0003392878861632198,0.0003159877087455243,0,0.4
comentario_1667476,"  Isso aconteceu comigo, fui preso em flagrante sem nenhuma  prova material pq a palavra da mulher está acima da presunção de inocência quando se trata de importunação sexual, ou seja, em casos de ""crimes"" contra a mulher não existe presunção de inocência. A diferença é que nunca vi a mulher na vida e não dei em cima dela, pelo contrário, ela que tava se roçando em mim. É o Brasil... Deixa de ser gado! Se a lei permite que um homem seja preso com ausência de materialidade e indício de autoria, logo terá muitas denúncias falsas e prisões arbitrárias.",1,1,0.017899036407470703,0.00031052701524458826,0.0016309765633195639,0.0015527332434430718,0.0034139840863645077,0.0005896551301702857,0.003908372949808836,0,0.4
comentario_124536,Mulheres Rússas vocês são um☝️ presente 🎁 de Deus vocês são mulheres completas para nós brasileiros estamos sofrendo nos ajudem.😊,1,0,0.20159976184368134,0.0004343136679381132,0.004323476925492287,0.07155679166316986,0.044833119958639145,0.001132487435825169,0.0023081384133547544,0,0.4
comentario_1161279,Mas a culpa é delas mesmo.. burras,1,1,0.987970769405365,0.0003595869638957083,0.012137966230511665,0.0011963630095124245,0.9802000522613525,0.0014721291372552514,0.0007675962406210601,1,0.4
comentario_1953177,"Não quer dizer nada, a não ser que você esteja com vontade de voltar e ser um reserva! Pare de procurar fotos e siga em frente!",0,0,0.006972278468310833,0.00017123845464084297,0.004931227769702673,0.0003148690448142588,0.0030607704538851976,0.000377010612282902,0.000949626904912293,0,0.4
comentario_2329640,"Eu uso roupas legais, acho importante manter a imagem. Mas como complemento. Acho que narrativa do autor do video nao se aplica a todos os casos. Apenas há algumas pessoas.",0,0,0.0004982168902643025,0.002996377879753709,0.024297669529914856,0.003518740413710475,0.020492808893322945,0.0012618971522897482,0.0007861793856136501,0,0.4
comentario_1176283,"A minha ex nunca foi de mostrar o corpo. "" Até pra mim ela ficava com vergonha"".... principalmente em rede sociais...ela raramente postava FT e até mesmo hj ela não posta ND e tals😕 sla a família dela ainda gosta de mim mas não fui eu quem errei e sim ela 😕eu fui fiel nesses quatro anos mas ela quis jogar nossos quatro anos no lixo 😕 eu tinha aceso as redes sociais dela e ela as minhas 😕😕mas no final até a família dela ficou com raiva dela inclusive o pai 😕😕😕 ou seja ela fez tudo isso comigo mas prejudicou a si mesma e a própria família pegou raiva dela e até o pai disse "" a minha filha morreu"" vc não é minha filha e muito menos eu sou seu pai...ela no final me abandonou e como consequência foi abandonada pela família 😕😕😕😕😕😕",0,1,0.03538411110639572,6.92961984896101e-05,0.003376403823494911,0.00019614954362623394,0.011731728911399841,0.0001342021714663133,0.000937001605052501,0,0.4
comentario_1772362,Eu que te agradeço por estar conosco aqui Cintia.,0,0,0.001414583413861692,0.002273667138069868,0.02202145755290985,0.002677153330296278,0.016255469992756844,0.0010136159835383296,0.0004896475002169609,0,0.4
comentario_844418,@ .A.R.-ji3ex vc usou o verbo passado como se fosse viúva k,0,0,0.011704427190124989,0.00014711396943312138,0.003753264434635639,0.00036788650322705507,0.009034236893057823,0.00014933432976249605,0.0004507916746661067,0,0.4
comentario_1816821,Pior é o que mais tem homem palpiteiro de rola.,0,1,0.08746829628944397,0.0002891622425522655,0.0034733598586171865,0.0014286796795204282,0.04333493113517761,0.002028425456956029,0.0031713019125163555,0,0.4
comentario_2512921,"Errar é  de todos, reconhecer o erro é dos fortes, perdoar é dos melhores",0,0,0.0027761156670749187,4.806985452887602e-05,0.0009765843860805035,0.0001424386427970603,0.0014182673767209053,0.00013578220386989415,0.00012347260781098157,0,0.4
comentario_1784478,"até porque q carne tá um absurdo de caro, bom mesmo é valorizar seu gordinho !!",0,0,0.6900302171707153,0.0008040330139920115,0.050853610038757324,0.0025816799607127905,0.46519652009010315,0.0015810491750016809,0.0037435900885611773,1,0.4
comentario_2229727,Meu Deus lindo demais.  Sensacional. Emocionante.  Guerreiro. Lindo casal.,0,0,0.0025625545531511307,7.16273789294064e-05,0.0015918229473754764,0.00015448308840859681,0.0009994973661378026,8.993016672320664e-05,0.00020592432701960206,0,0.4
comentario_1615559,"@  sim eu entendi , realmente um livramento é a mulher vai carregar o erro pro resto da vida chamando ela de mãe",0,0,0.04062162712216377,0.00033906864700838923,0.003991125617176294,0.004690645262598991,0.009298202581703663,0.0012957699364051223,0.0022057488095015287,0,0.4
comentario_1098276,O Pondė é a prova de um Homem contaminado por feminismo hora está na realidade hora está em Nárnia,1,1,0.029825769364833832,0.0001297292619710788,0.0007311130757443607,0.01346621010452509,0.005052851978689432,0.00040112852002494037,0.0010262628784403205,0,0.4
comentario_2305361,"@  Ele tem um canal novo , Edson Castro",0,0,0.0013627930311486125,0.001621297444216907,0.01921158656477928,0.003136715618893504,0.016211234033107758,0.0008684542262926698,0.0003431223158258945,0,0.4
comentario_2242920,*Sério? Aqui no exterior o feminismo está muito mais avançado!*,0,0,0.03613384813070297,0.00021169634419493377,0.0021559095475822687,0.015643157064914703,0.00755110289901495,0.0003573414287529886,0.002466165227815509,0,0.4
comentario_199298,Eu tenho tio médico formado vai fazer 2 anos desempregado,0,0,0.003033083165064454,0.00011058691598009318,0.0027989083901047707,0.0001752769894665107,0.0025946737732738256,0.00014325509255286306,0.00027042991132475436,0,0.4
comentario_2679848,Aqui em casa é assim não trago amigas e nem meu marido traz amigos dele.nossa casa é nossa privacidade e não a casa da mãe Joana 😂😂.e Também não falo do meu casamento para ninguém nem para parentes próximo tudo oq eu preciso resolver é com meu marido não precisa ninguém saber,0,0,0.002375478157773614,9.501713793724775e-05,0.0023351015988737345,0.00016070787387434393,0.0018408343894407153,0.00010809511150000617,0.00042701754136942327,0,0.4
comentario_2775882,As mulheres sempre prontas para um amor verdadeiro!,1,0,0.01086865272372961,0.00020791261340491474,0.0009956008289009333,0.005129877477884293,0.0013195957290008664,0.0006951867253519595,0.0018478420097380877,0,0.4
comentario_2412332,Parabéns para essa mae ela e um exemplo,0,0,0.0021897805854678154,0.00014033458137419075,0.0021804349962621927,0.00023591099306941032,0.003326545236632228,0.00011607851774897426,0.0002901351253967732,0,0.4
comentario_2488207,Nada  nem circunstâncias mechem  com o nosso caráter,0,0,0.004330831579864025,4.535615516942926e-05,0.0010749149369075894,0.0001265884784515947,0.0024054227396845818,9.077875438379124e-05,0.0001105102855945006,0,0.4
comentario_2415417,A culpa disso são dos caras que não controlam o próprio pau,0,1,0.7793835401535034,0.00507016247138381,0.25517410039901733,0.0041272519156336784,0.04357751086354256,0.0033743411768227816,0.7721039056777954,1,0.4
comentario_883896,"No máximo um batom,me descreveu ❤ tô pronta 😂❤",0,0,0.001624067546799779,0.00024002256395760924,0.002749574836343527,0.00031618328648619354,0.0007461519562639296,0.0005906589212827384,0.0002910926705226302,0,0.4
comentario_2805560,Não muito obrigado e só vou deixa pras vagabundas que gostam mesmo,1,1,0.7702058553695679,0.009289974346756935,0.06904557347297668,0.011739946901798248,0.0658804178237915,0.0033888909965753555,0.028112897649407387,1,0.4
comentario_2011711,"@  não responde perfis assim. São sempre perfis sem fotos, e muito provavelmente usados por homens muito frustrados que se sentem um pouquinho melhor atacando mulheres. Parabéns pela atitude com o marido.",0,0,0.04446520283818245,0.00028788999770767987,0.0011155285174027085,0.014538147486746311,0.009184633381664753,0.0006694369367323816,0.0022840143647044897,0,0.4
comentario_2863796,"Saudações meus caros! Sério que ela acha mesmo que ele não sabe? Pra vocês verem como algumas delas nos veem. Meros fantoches. O que me preocupa é fato de ainda terem muitos homens que às idolatra como seres iluminados, não vou engana-los, a maioria ainda as veem assim…Forte abraço e fiquem com Deus.",1,1,0.009825131855905056,8.789186540525407e-05,0.0010356766870245337,0.00044447483378462493,0.005643101874738932,0.00026383859221823514,0.0004191393672954291,0,0.4
comentario_2452575,"Vamos lá, ele citou 3 mulheres . Somos em quantas mesmo ? Existe sim , muitas mulheres sacanas por aí, que não valorizam um casamento , que tudo é vaidade . Mas se procurarem nos lugares certos, por exemplo   , achará mulheres de valor ! Não se enganem com vídeos na Internet,  mulheres sábias normalmente não estão neles ....Sejam realistas e saibam valorizar uma mulher de verdade quando emcontrá-la , porque normalmente,  elas não serão padrão como vocês querem .",0,0,0.05469373241066933,0.00020086430595256388,0.0013949821004644036,0.013487029820680618,0.017922665923833847,0.0004426686791703105,0.001232691458426416,0,0.4
comentario_364535,"Brincadeira???😮 , tá louco? Mudaram até o nome da frutaria com O???😮.",0,0,0.20950330793857574,8.32339355838485e-05,0.005160448141396046,0.00036262013600207865,0.13016504049301147,0.00017853803001344204,0.0002843820839188993,0,0.4
comentario_1409346,A maioria dos homens hoje acham que não vale a pena casar.,0,0,0.014881960116326809,0.0003411096113268286,0.00117177062202245,0.004371261689811945,0.0035027475096285343,0.0012620744528248906,0.0009307956788688898,0,0.4
comentario_1887158,"Qual o nome dessa moça ou o Instagram dela, alguém sabe por gentileza ?!",0,0,0.003596673719584942,6.206161924637854e-05,0.0010233568027615547,0.00021723558893427253,0.0017470296006649733,6.910594674991444e-05,0.00024218758335337043,0,0.4
comentario_21660,Calma aí né…Político não fala da família do outro por que tem caráter…e sim porque sabe que todo o dinheiro sujo está no nome dos familiares.,0,1,0.08206823468208313,4.078432175447233e-05,0.0027901185676455498,0.00014664340415038168,0.055665869265794754,8.016609353944659e-05,0.00015407457249239087,0,0.4
comentario_49664,"Tirando o Léo, foi o melhor podcast que eu ja vi",0,0,0.0013486583484336734,0.0001694729580776766,0.002857175190001726,0.00029162183636799455,0.002368050627410412,0.00013082729128655046,0.0001169716488220729,0,0.4
comentario_2798950,Comentario maravilhoso😂😂 merece ser fixado,0,0,0.0022693672217428684,0.0001228973997058347,0.0009999974863603711,0.0002734076406341046,0.0005549113266170025,0.0008357852348126471,0.00016859214520081878,0,0.4
comentario_327029,Seu o filho é seu cuide não deixa de um lado pro outro esses praga tão por tão lado 😢😢😢😢😢 por mim castrava,0,1,0.3266482651233673,0.0008733535069040954,0.028224729001522064,0.002437122166156769,0.11158549040555954,0.018604449927806854,0.007026498671621084,0,0.4
comentario_1365179,Herança não entra no divórcio O sistema trata de Ferrar é quem trabalha,0,0,0.000712330627720803,0.0002585910551715642,0.0027642971836030483,0.0003511378599796444,0.001962830778211355,0.0002735857560764998,0.00021233008010312915,0,0.4
comentario_2062638,É mais fácil melhorar a aparência do que conseguir esse tipo de bem,0,0,0.0014074253849685192,0.00013022315397392958,0.0014672979013994336,0.00022441614419221878,0.0009386194287799299,0.00021991709945723414,0.00011003887630067766,0,0.4
comentario_849555,"Tem que ser igual o enruGADO batista , 25 anos é véia, quando vou na clínica de massagem não quero nem saber de trintona.",1,1,0.2315654307603836,0.0006870420183986425,0.019449451938271523,0.012110883370041847,0.0821358859539032,0.003023396246135235,0.014276698231697083,0,0.4
comentario_1269813,"Provavelmente sim, mas isso não torna os estudos do Netlab menos enviesados.",0,0,0.0017838410567492247,0.0001575413771206513,0.0022789249196648598,0.0004883296205662191,0.0032345394138246775,0.0001479819038650021,8.934499055612832e-05,0,0.4
comentario_1923732,As futuras esposas de alguém só saem do carrossel acima de 30,1,1,0.01712510548532009,0.00013556033081840724,0.002444821409881115,0.0007185647264122963,0.003803312312811613,0.001621181727387011,0.0019288907060399652,0,0.4
comentario_1666568,Se ele quiser ser o prêmio da quebrada? E ter um alvo nele mesmo?😂😅,0,0,0.011166062206029892,0.00011803079542005435,0.0011335485614836216,0.00023247062927111983,0.0016111456789076328,0.005625587422400713,0.00048408916336484253,0,0.4
comentario_1362313,"Os caras olham pra mulheres assim, provavelmente conheceu ela assim, pq n acho q ela mudou a vestimenta dps do casamento, deveria ter escolhido melhor ne ? Foi se atrair por uma q se veste vulgar e pq casou acha q a pessoa vai mudar, escolham melhor ! Pra nao chegar a esse ponto.",1,1,0.008397601544857025,6.472390668932348e-05,0.0006230506114661694,0.0005815316108055413,0.00305396830663085,0.00012887506454717368,0.0005083476426079869,0,0.4
comentario_2118265,@  onde foi que eu disse que explicar a história do feminismo é ir mal? Tá viajandoFugiu das aulas de português foi?,0,1,0.03915635496377945,0.00018897774862125516,0.003581204218789935,0.0057259853929281235,0.015186908654868603,0.0003253787290304899,0.002162833232432604,0,0.4
comentario_1116893,@  Ignore o passado do homem e destrua o seu futuro.,0,1,0.05176697298884392,0.0003222441300749779,0.0007260923157446086,0.0024314681068062782,0.014917907305061817,0.004600957501679659,0.000524500326719135,0,0.4
comentario_2762384,"Não precisa ir na associação americana,é só dar uma olhada nos psicológicos brasileiros,tem até uma página no insta,só louco da cabeça",0,1,0.5842096209526062,0.0009020163561217487,0.02371004782617092,0.003588112536817789,0.3771856129169464,0.0013442354975268245,0.0022857263684272766,1,0.4
comentario_2351629,"  não é óbvio? As mulheres gostam de emoção e curtição, porque a maioria faz filho com mal caráter? a resposta é muito óbvio, a maioria só arruma tranqueira ou se ilude com bom papo e palavras doces e depois vem *""nenhum homem presta ou ""homem é tudo igual.""*",1,1,0.016894372180104256,0.0003443546302150935,0.0013103242963552475,0.0035825385712087154,0.0047685191966593266,0.0005288719548843801,0.001668343786150217,0,0.4
comentario_823493,Só n seja abusivo meu pai me proibia até de jogar bola hoje já vai completar 7 anos q n vejo e fui para o Ceará para nunca mais voltar.,0,0,0.09849116951227188,0.00029034679755568504,0.013055550865828991,0.0010709541384130716,0.02035936526954174,0.0010644713183864951,0.002851468278095126,0,0.4
