id_comentario_anonimizado,comentario,final_misoginia,final_toxicidade,texto_analise,score_perspective_max,latencia_api,detalhe_toxicity,detalhe_severe,detalhe_identity,detalhe_insult,tipo_origem,unified_label,original_label_column
comentario_292303,"Essa é mãe com palavra...consequências de um "" tolo "" que achou que era o "" pá ""... .vacilão otário, Tirou quem o amou, amamentou, antes dos ""amiguinhos ""...Vai drão,jão...VACILÃO!!!!",0,1,"Essa é mãe com palavra...consequências de um "" tolo "" que achou que era o "" pá ""... .vacilão otário, Tirou quem o amou, amamentou, antes dos ""amiguinhos ""...Vai drão,jão...VACILÃO!!!!",0.65231085,0.11640691757202148,0.5885171,0.19761463,0.059311368,0.65231085,comentarios_misoginia,0,final_misoginia
comentario_403919,Queria saber qual o regime constituiu essa união 😂.  Vai separar pra ver!,0,0,Queria saber qual o regime constituiu essa união 😂.  Vai separar pra ver!,0.023317585,0.14169669151306152,0.023317585,0.0008678436,0.0040327664,0.01625293,comentarios_misoginia,0,final_misoginia
comentario_579400,Uma mulher que entendeu o universo masculino😮,0,0,Uma mulher que entendeu o universo masculino😮,0.029092113,0.11217236518859863,0.029092113,0.0012874603,0.011617327,0.0142009165,comentarios_misoginia,0,final_misoginia
comentario_1772362,Eu que te agradeço por estar conosco aqui Cintia.,0,0,Eu que te agradeço por estar conosco aqui Cintia.,0.005323113,0.09510564804077148,0.0019084706,0.00017762184,0.0006058399,0.005323113,comentarios_misoginia,0,final_misoginia
comentario_542510,Mais armado que a chuva na nuca dele. 😂😂😂,0,0,Mais armado que a chuva na nuca dele. 😂😂😂,0.2854971,0.11137056350708008,0.2854971,0.023076924,0.01191331,0.21368977,comentarios_misoginia,0,final_misoginia
comentario_2242920,*Sério? Aqui no exterior o feminismo está muito mais avançado!*,0,0,*Sério? Aqui no exterior o feminismo está muito mais avançado!*,0.102626406,0.11117911338806152,0.102626406,0.0043678284,0.09659086,0.02373764,comentarios_misoginia,0,final_misoginia
comentario_2086929,Olá abaixa o aplicativo da rádio da TV novo tempo para você ouvir a palavra de Deus 24 horas em espanhol tem inglês isso mesmo mande para mais pessoas ler a Bíblia que a carta de Deus Apocalipse 14:12 e êxodo capítulo 21 a 11 leia também Ezequiel capítulo 20 e versículo 12:20,0,0,Olá abaixa o aplicativo da rádio da TV novo tempo para você ouvir a palavra de Deus 24 horas em espanhol tem inglês isso mesmo mande para mais pessoas ler a Bíblia que a carta de Deus Apocalipse 14:12 e êxodo capítulo 21 a 11 leia também Ezequiel capítulo 20 e versículo 12:20,0.011749268,0.11000585556030273,0.011749268,0.0011730194,0.0047357255,0.0076838774,comentarios_misoginia,0,final_misoginia
comentario_2679848,Aqui em casa é assim não trago amigas e nem meu marido traz amigos dele.nossa casa é nossa privacidade e não a casa da mãe Joana 😂😂.e Também não falo do meu casamento para ninguém nem para parentes próximo tudo oq eu preciso resolver é com meu marido não precisa ninguém saber,0,0,Aqui em casa é assim não trago amigas e nem meu marido traz amigos dele.nossa casa é nossa privacidade e não a casa da mãe Joana 😂😂.e Também não falo do meu casamento para ninguém nem para parentes próximo tudo oq eu preciso resolver é com meu marido não precisa ninguém saber,0.04216247,0.0803987979888916,0.04216247,0.0010633469,0.004606233,0.027476108,comentarios_misoginia,0,final_misoginia
comentario_2738767,"@  chocada 😲,  eu sou divorciada ha 5 anos ,e em abstinência sexual desde a separação,  fácil não é,  mas é escolha,  decisão,  não serei dominada pelas minhas vontades",0,0,"@  chocada 😲,  eu sou divorciada ha 5 anos ,e em abstinência sexual desde a separação,  fácil não é,  mas é escolha,  decisão,  não serei dominada pelas minhas vontades",0.12260055,0.12375044822692871,0.12260055,0.0030326843,0.009693438,0.020837102,comentarios_misoginia,0,final_misoginia
comentario_1254871,"Opa, acredito que Jesus e a santidade estão em um patamar acima das coisas desta terra, ser rico ou prospero não é um problema, mas trocar sua santidade para viver uma vida financeira boa na terra não compensa, da pra ser santo e próspero ao mesmo tempo, não é necessário arriscar o seu relacionamento com Deus por quantias de dinheiro, pois isso é amá-lo, e quem ama o dinheiro não ama a Deus, pois só podemos servir um Senhor.",0,0,"Opa, acredito que Jesus e a santidade estão em um patamar acima das coisas desta terra, ser rico ou prospero não é um problema, mas trocar sua santidade para viver uma vida financeira boa na terra não compensa, da pra ser santo e próspero ao mesmo tempo, não é necessário arriscar o seu relacionamento com Deus por quantias de dinheiro, pois isso é amá-lo, e quem ama o dinheiro não ama a Deus, pois só podemos servir um Senhor.",0.02249265,0.0892326831817627,0.02249265,0.001115799,0.007288578,0.011768902,comentarios_misoginia,0,final_misoginia
comentario_1802553,"""...Tu conhecerás tua esposa no divórcio, teus irmãos na herança e teus filhos na velhice...""🍷🗿",0,0,"""...Tu conhecerás tua esposa no divórcio, teus irmãos na herança e teus filhos na velhice...""🍷🗿",0.04735767,0.10455942153930664,0.04735767,0.002117157,0.004846719,0.018258847,comentarios_misoginia,0,final_misoginia
comentario_2775882,As mulheres sempre prontas para um amor verdadeiro!,1,0,As mulheres sempre prontas para um amor verdadeiro!,0.036634352,0.1117560863494873,0.036634352,0.0019836426,0.031980325,0.017743196,comentarios_misoginia,1,final_misoginia
comentario_474384,Negar nosso esperma a elas já faz a sociedade ruir....,1,1,Negar nosso esperma a elas já faz a sociedade ruir....,0.40336934,0.07539129257202148,0.40336934,0.020127986,0.089145996,0.16890354,comentarios_misoginia,1,final_misoginia
comentario_44013,"Ta bonita do mesmo jeito , com maquiagem e ssem continua linda❤",0,0,"Ta bonita do mesmo jeito , com maquiagem e ssem continua linda❤",0.014953613,0.13085579872131348,0.014953613,0.0008916855,0.0026638457,0.009640889,comentarios_misoginia,0,final_misoginia
comentario_2488207,Nada  nem circunstâncias mechem  com o nosso caráter,0,0,Nada  nem circunstâncias mechem  com o nosso caráter,0.008733413,0.10235452651977539,0.008733413,0.00041484833,0.0016001574,0.008253881,comentarios_misoginia,0,final_misoginia
comentario_2971315,"Traduzindo.Se for pegar, use camisinha e depois desapareça.",1,1,"Traduzindo.Se for pegar, use camisinha e depois desapareça.",0.20973456,0.10262084007263184,0.20973456,0.015350811,0.0076955543,0.07967083,comentarios_misoginia,1,final_misoginia
comentario_2415417,A culpa disso são dos caras que não controlam o próprio pau,0,1,A culpa disso são dos caras que não controlam o próprio pau,0.5921536,0.12047266960144043,0.5921536,0.031420294,0.052490227,0.26957804,comentarios_misoginia,0,final_misoginia
comentario_2011711,"@  não responde perfis assim. São sempre perfis sem fotos, e muito provavelmente usados por homens muito frustrados que se sentem um pouquinho melhor atacando mulheres. Parabéns pela atitude com o marido.",0,0,"@  não responde perfis assim. São sempre perfis sem fotos, e muito provavelmente usados por homens muito frustrados que se sentem um pouquinho melhor atacando mulheres. Parabéns pela atitude com o marido.",0.25462922,0.10765862464904785,0.25462922,0.004310608,0.07425626,0.16817254,comentarios_misoginia,0,final_misoginia
comentario_277866,"Verdade , é bonito sim e ela é linda .",0,0,"Verdade , é bonito sim e ela é linda .",0.009675868,0.12335753440856934,0.009675868,0.0006198883,0.0018868907,0.0072468747,comentarios_misoginia,0,final_misoginia
comentario_890128,Você quis dizer que uma é muito burra e outra é mais inteligente? Começo titias pobres que estão muito mais bem conservadas que essa bucha de canhão ai,1,1,Você quis dizer que uma é muito burra e outra é mais inteligente? Começo titias pobres que estão muito mais bem conservadas que essa bucha de canhão ai,0.60254884,0.1091609001159668,0.60254884,0.23223428,0.15517195,0.57566804,comentarios_misoginia,1,final_misoginia
comentario_364535,"Brincadeira???😮 , tá louco? Mudaram até o nome da frutaria com O???😮.",0,0,"Brincadeira???😮 , tá louco? Mudaram até o nome da frutaria com O???😮.",0.16043124,0.11079549789428711,0.16043124,0.0023555756,0.0030708222,0.08434689,comentarios_misoginia,0,final_misoginia
comentario_457718,"Minha companheira também receb€ 3.000/4000 mas tem que cuidar da casa, das crianças e pagar as contas e fazer as compras",0,0,"Minha companheira também receb€ 3.000/4000 mas tem que cuidar da casa, das crianças e pagar as contas e fazer as compras",0.0062398682,0.14092087745666504,0.0039111865,0.00027298927,0.00073533243,0.0062398682,comentarios_misoginia,0,final_misoginia
comentario_1010359,Que lindos! É isso mesmo o importante são as boas atitudes que só vcs dois compartilham!,0,0,Que lindos! É isso mesmo o importante são as boas atitudes que só vcs dois compartilham!,0.0061448677,0.09756350517272949,0.0036912805,0.00023365021,0.0006520872,0.0061448677,comentarios_misoginia,0,final_misoginia
comentario_1258010,"Isso é mãe 🤮 sem noção, parabéns a vc Vitor 👊 vai ser feliz menino, segue acreditando em Cristo, tenha sua Fé, Deus está com digo sempre 🫵👍🙏",0,1,"Isso é mãe 🤮 sem noção, parabéns a vc Vitor 👊 vai ser feliz menino, segue acreditando em Cristo, tenha sua Fé, Deus está com digo sempre 🫵👍🙏",0.16331999,0.13099265098571777,0.16331999,0.0060653687,0.006289636,0.09416737,comentarios_misoginia,0,final_misoginia
comentario_2665566,"Ué, eu demorei pra casar por isso, só que fiquei viúva, exemplo de casa, meus pais se conhecem desde os 7 anos e são casados a 45 já, viveram todas as dificuldades e estão aí firmes e fortes, tive outros namoros antes de casar, mas, na minha família divórcio só em último caso, tipo violência mesmo. Então, optei por não ficar pois via que a pessoa não seria compatível de estar junto quando tudo estivesse difícil. Casei só com 35 anos, só que no meu caso foi uma fatalidade msmo. No caso é mto simples resolver o problema patrimonial, pre-nupcial e separação total de bens, eu jamais me casaria em comunhão alguma de bens. Pq eu também não quero perder os meus.😅",0,0,"Ué, eu demorei pra casar por isso, só que fiquei viúva, exemplo de casa, meus pais se conhecem desde os 7 anos e são casados a 45 já, viveram todas as dificuldades e estão aí firmes e fortes, tive outros namoros antes de casar, mas, na minha família divórcio só em último caso, tipo violência mesmo. Então, optei por não ficar pois via que a pessoa não seria compatível de estar junto quando tudo estivesse difícil. Casei só com 35 anos, só que no meu caso foi uma fatalidade msmo. No caso é mto simples resolver o problema patrimonial, pre-nupcial e separação total de bens, eu jamais me casaria em comunhão alguma de bens. Pq eu também não quero perder os meus.😅",0.041172907,0.1497507095336914,0.041172907,0.0036621094,0.008546505,0.019934712,comentarios_misoginia,0,final_misoginia
comentario_2663903,"Tu assistiu? Kkkkkk as mulheres da minha família nenhuma assistiu com exceção da mulher do meu irmão. Filme horrível segundo ela . Com viés mais lacrador e pautas de esquerda, não convence muito. E vc gosta de Barbie? Vc não tem muita cara disso. Mas cada um com seu gosto né.",0,1,"Tu assistiu? Kkkkkk as mulheres da minha família nenhuma assistiu com exceção da mulher do meu irmão. Filme horrível segundo ela . Com viés mais lacrador e pautas de esquerda, não convence muito. E vc gosta de Barbie? Vc não tem muita cara disso. Mas cada um com seu gosto né.",0.2524482,0.11965370178222656,0.2524482,0.007209778,0.018369852,0.2469859,comentarios_misoginia,0,final_misoginia
comentario_1281111,Ela deve ser santos dos últimos dias! Eu sou e minha família tbm e isso é muito comum entre nós!!,0,0,Ela deve ser santos dos últimos dias! Eu sou e minha família tbm e isso é muito comum entre nós!!,0.009864358,0.10838603973388672,0.009864358,0.00069618225,0.0024603575,0.007797878,comentarios_misoginia,0,final_misoginia
comentario_745578,Os caras só ficam ate achar uma melhor.,1,0,Os caras só ficam ate achar uma melhor.,0.0131943645,0.1368117332458496,0.0131943645,0.00056028366,0.0019886347,0.009526889,comentarios_misoginia,1,final_misoginia
comentario_398227,"A resposta dela, mereceu a contra-resposta... KkkkkkkVida que segue",0,0,"A resposta dela, mereceu a contra-resposta... KkkkkkkVida que segue",0.043399423,0.060355424880981445,0.043399423,0.0012874603,0.001655654,0.026058068,comentarios_misoginia,0,final_misoginia
comentario_327029,Seu o filho é seu cuide não deixa de um lado pro outro esses praga tão por tão lado 😢😢😢😢😢 por mim castrava,0,1,Seu o filho é seu cuide não deixa de um lado pro outro esses praga tão por tão lado 😢😢😢😢😢 por mim castrava,0.55739564,0.11335492134094238,0.55739564,0.44787344,0.08500996,0.5130944,comentarios_misoginia,0,final_misoginia
comentario_2873356,"Que pergunta besta é essa? Óbvio que sem filhos. E linda, gostosa, bom carater, fiél e virgem! Filho tem que ser meu quando fizer nela quando já tiver bons recursos e se merecer ainda!",1,1,"Que pergunta besta é essa? Óbvio que sem filhos. E linda, gostosa, bom carater, fiél e virgem! Filho tem que ser meu quando fizer nela quando já tiver bons recursos e se merecer ainda!",0.20705862,0.12353301048278809,0.20705862,0.016641939,0.010951365,0.083359696,comentarios_misoginia,1,final_misoginia
comentario_1365179,Herança não entra no divórcio O sistema trata de Ferrar é quem trabalha,0,0,Herança não entra no divórcio O sistema trata de Ferrar é quem trabalha,0.23343207,0.08191108703613281,0.23343207,0.009536743,0.006511623,0.07840354,comentarios_misoginia,0,final_misoginia
comentario_825676,"😂fácil, fácil e só pagar a diária da senhora. A senhora cobra uma diária bem mais cara o dobro e vê o que vai dá 😂Então é eles têm que cuidar da senhora 😂ou a senhora entra com abandono de incapaz 😂",0,0,"😂fácil, fácil e só pagar a diária da senhora. A senhora cobra uma diária bem mais cara o dobro e vê o que vai dá 😂Então é eles têm que cuidar da senhora 😂ou a senhora entra com abandono de incapaz 😂",0.27412915,0.13685345649719238,0.27412915,0.008888245,0.026408968,0.24928534,comentarios_misoginia,0,final_misoginia
comentario_1980186,Pura verdade. As vzs vejo minha mae chamando atencao do marido dela como se ele fosse filho. Tv um dia q n aguentei e falei p ela ELE É SEU MARIDO N SEU FILHO.,0,0,Pura verdade. As vzs vejo minha mae chamando atencao do marido dela como se ele fosse filho. Tv um dia q n aguentei e falei p ela ELE É SEU MARIDO N SEU FILHO.,0.06104896,0.11969780921936035,0.06104896,0.0035858154,0.0060676485,0.032799274,comentarios_misoginia,0,final_misoginia
comentario_253576,1:19:30 segundo o adrilles o Brasil teve o maior crescimento da AL e funcionou a pleno emprego. O cara quer reescrever a história mesmo. Mds,0,0,1:19:30 segundo o adrilles o Brasil teve o maior crescimento da AL e funcionou a pleno emprego. O cara quer reescrever a história mesmo. Mds,0.0665887,0.12496113777160645,0.0665887,0.002155304,0.0075845607,0.023608726,comentarios_misoginia,0,final_misoginia
comentario_2547160,"@  Deus não nós dá nada que vai nos destruir. Quem rouba,mata e destrói é satanás.",0,0,"@  Deus não nós dá nada que vai nos destruir. Quem rouba,mata e destrói é satanás.",0.3625127,0.15966129302978516,0.3625127,0.023076924,0.06567776,0.26957804,comentarios_misoginia,0,final_misoginia
comentario_2855970,"Como evangélico q fui por duas décadas e meia, assino em baixo o q vc disse! Hj em dia quero distância dessa galera! É só ego, narcisismo, totalitarismo e individualismo!",0,1,"Como evangélico q fui por duas décadas e meia, assino em baixo o q vc disse! Hj em dia quero distância dessa galera! É só ego, narcisismo, totalitarismo e individualismo!",0.2820025,0.10763096809387207,0.2820025,0.01083374,0.116281845,0.26957804,comentarios_misoginia,0,final_misoginia
comentario_849555,"Tem que ser igual o enruGADO batista , 25 anos é véia, quando vou na clínica de massagem não quero nem saber de trintona.",1,1,"Tem que ser igual o enruGADO batista , 25 anos é véia, quando vou na clínica de massagem não quero nem saber de trintona.",0.28548008,0.10926485061645508,0.28548008,0.013349563,0.04564415,0.2817503,comentarios_misoginia,1,final_misoginia
comentario_1201015,Quanto mais safado mais ele atrai a mulherada,1,1,Quanto mais safado mais ele atrai a mulherada,0.20056234,0.06285738945007324,0.20056234,0.01121521,0.06476828,0.08508729,comentarios_misoginia,1,final_misoginia
comentario_176122,Eu acho que roupa é um dos itens que define carater da mulher sim.,1,1,Eu acho que roupa é um dos itens que define carater da mulher sim.,0.009236055,0.11476826667785645,0.009236055,0.0005531311,0.0047727237,0.007797878,comentarios_misoginia,1,final_misoginia
comentario_1749901,"@  Bem que vc fez, essas CUlheres de hoje nem ajuda merecem",1,1,"@  Bem que vc fez, essas CUlheres de hoje nem ajuda merecem",0.45758462,0.06699395179748535,0.42568782,0.07805709,0.36702603,0.45758462,comentarios_misoginia,1,final_misoginia
comentario_1514207,"Eu c 42 digo ""é verdade esse bilhete.""",0,0,"Eu c 42 digo ""é verdade esse bilhete.""",0.009110395,0.1303997039794922,0.009110395,0.0007534027,0.0014984132,0.007303875,comentarios_misoginia,0,final_misoginia
comentario_1362313,"Os caras olham pra mulheres assim, provavelmente conheceu ela assim, pq n acho q ela mudou a vestimenta dps do casamento, deveria ter escolhido melhor ne ? Foi se atrair por uma q se veste vulgar e pq casou acha q a pessoa vai mudar, escolham melhor ! Pra nao chegar a esse ponto.",1,1,"Os caras olham pra mulheres assim, provavelmente conheceu ela assim, pq n acho q ela mudou a vestimenta dps do casamento, deveria ter escolhido melhor ne ? Foi se atrair por uma q se veste vulgar e pq casou acha q a pessoa vai mudar, escolham melhor ! Pra nao chegar a esse ponto.",0.112436704,0.12772703170776367,0.112436704,0.004558563,0.03223813,0.06354945,comentarios_misoginia,1,final_misoginia
comentario_2118265,@  onde foi que eu disse que explicar a história do feminismo é ir mal? Tá viajandoFugiu das aulas de português foi?,0,1,@  onde foi que eu disse que explicar a história do feminismo é ir mal? Tá viajandoFugiu das aulas de português foi?,0.33255672,0.13380122184753418,0.33255672,0.013995127,0.1714862,0.25205973,comentarios_misoginia,0,final_misoginia
comentario_2762384,"Não precisa ir na associação americana,é só dar uma olhada nos psicológicos brasileiros,tem até uma página no insta,só louco da cabeça",0,1,"Não precisa ir na associação americana,é só dar uma olhada nos psicológicos brasileiros,tem até uma página no insta,só louco da cabeça",0.34101152,0.11309933662414551,0.30464804,0.011138916,0.10221587,0.34101152,comentarios_misoginia,0,final_misoginia
comentario_1780289,Ela faz tudo com esse primo....,0,0,Ela faz tudo com esse primo....,0.10653123,0.0998077392578125,0.10653123,0.002937317,0.003921773,0.029493837,comentarios_misoginia,0,final_misoginia
comentario_1786281,"Porra, a buceta vai matar a gente 😭",1,1,"Porra, a buceta vai matar a gente 😭",0.8364697,0.11158514022827148,0.8364697,0.44787344,0.1015541,0.4718924,comentarios_misoginia,1,final_misoginia
comentario_1769267,"Tudo isso tem que ser conversado antes de casar esse povo parece mudo, conversa uma coisa aqui e depois é outra ou não tem palavra.🙄Mas tem gente que prefere ter uma vida mais simples mesmo tendo dinheiro só pra ter uma casa e dinheiro pra cuidar da saúde e ta tudo bem, ou realmente é igual esse moço falou. Eu tô numa fase da vida que tudo que eu queria era ter uma casa mais ou menos confortável na roça e nunca mais viver na cidade, correndo atrás de consumir e consumir 😕 Mas não entendo vcs, se fosse ao contrário muitos homens Taria aqui metendo o pau na mulher dizendo que o homem trabalha sozinho a mulher não trabalha pra ajudar.🙄 Vai entender vcs credo",0,0,"Tudo isso tem que ser conversado antes de casar esse povo parece mudo, conversa uma coisa aqui e depois é outra ou não tem palavra.🙄Mas tem gente que prefere ter uma vida mais simples mesmo tendo dinheiro só pra ter uma casa e dinheiro pra cuidar da saúde e ta tudo bem, ou realmente é igual esse moço falou. Eu tô numa fase da vida que tudo que eu queria era ter uma casa mais ou menos confortável na roça e nunca mais viver na cidade, correndo atrás de consumir e consumir 😕 Mas não entendo vcs, se fosse ao contrário muitos homens Taria aqui metendo o pau na mulher dizendo que o homem trabalha sozinho a mulher não trabalha pra ajudar.🙄 Vai entender vcs credo",0.09785384,0.11091494560241699,0.09785384,0.0021266937,0.0061416444,0.070482984,comentarios_misoginia,0,final_misoginia
comentario_1295722,Duas almas penadas numa academia enorme e ela quer a janela do cara? Tem gente que sai de casa pra monetizar com visualização. Celular deveria ser proibido em academia.,0,1,Duas almas penadas numa academia enorme e ela quer a janela do cara? Tem gente que sai de casa pra monetizar com visualização. Celular deveria ser proibido em academia.,0.05378982,0.11337780952453613,0.05378982,0.0029945374,0.004680229,0.02618698,comentarios_misoginia,0,final_misoginia
comentario_2829126,"Essas frases de supervalorização só são faladas por pessoas que estão percebendo que a coisas tá indo pro buraco, mas querem de todo jeito se enganar. É possível lutar pelo casamento, mas esse não é o jeito.E,. discordando do dono do vídeo, casamento até que morte os separe ainda existe sim, só que a maioria começa errado e, mesmo percebendo isso, não se esforça pra mudar, pra melhorar. Então, essa conversa é pra gente grande de verdade, gente madura, que sabe que precisa melhorar para e pelo outro e não nem nunca apenas para si.",0,0,"Essas frases de supervalorização só são faladas por pessoas que estão percebendo que a coisas tá indo pro buraco, mas querem de todo jeito se enganar. É possível lutar pelo casamento, mas esse não é o jeito.E,. discordando do dono do vídeo, casamento até que morte os separe ainda existe sim, só que a maioria começa errado e, mesmo percebendo isso, não se esforça pra mudar, pra melhorar. Então, essa conversa é pra gente grande de verdade, gente madura, que sabe que precisa melhorar para e pelo outro e não nem nunca apenas para si.",0.091913216,0.10599184036254883,0.091913216,0.0038146973,0.008213525,0.04207976,comentarios_misoginia,0,final_misoginia
comentario_1344909,Quando ela falou tiktok eu já desisti de assistir!,0,0,Quando ela falou tiktok eu já desisti de assistir!,0.054779384,0.12480854988098145,0.054779384,0.001707077,0.0024973555,0.025155678,comentarios_misoginia,0,final_misoginia
comentario_2262822,Será este texto também serve para os homens!!!,0,0,Será este texto também serve para os homens!!!,0.006667371,0.11063885688781738,0.005906049,0.00024437904,0.0016001574,0.006667371,comentarios_misoginia,0,final_misoginia
comentario_1111537,"Já assisti e recomendo fortemente! Parabéns pela excelente análise! Mas o pessoal que segue ""pessoas"" como Hime, Douglas e Afonso não vai mudar depois de assistir, primeiro pq não não entender, segundo pq não são honestos. Vão continuar repetindo as mesmas ofensas de sempre pq faz parte da natureza deles de haters.",0,1,"Já assisti e recomendo fortemente! Parabéns pela excelente análise! Mas o pessoal que segue ""pessoas"" como Hime, Douglas e Afonso não vai mudar depois de assistir, primeiro pq não não entender, segundo pq não são honestos. Vão continuar repetindo as mesmas ofensas de sempre pq faz parte da natureza deles de haters.",0.23235008,0.1103360652923584,0.23235008,0.0032424927,0.011173353,0.22303216,comentarios_misoginia,0,final_misoginia
comentario_576584,Eu comia a sobremesa  primeiro 😊,0,0,Eu comia a sobremesa  primeiro 😊,0.0062493687,0.12253952026367188,0.005686143,0.00045776367,0.0008786991,0.0062493687,comentarios_misoginia,0,final_misoginia
comentario_1364254,"Daqui a pouco, a gente precisará pedir para o Juiz consultar o VAR, quase a todo momento.Esperamos também que o Juiz e o VAR, não sejam Cavaleiros Medievais.",0,0,"Daqui a pouco, a gente precisará pedir para o Juiz consultar o VAR, quase a todo momento.Esperamos também que o Juiz e o VAR, não sejam Cavaleiros Medievais.",0.04315203,0.11621522903442383,0.04315203,0.0009441376,0.0035887922,0.030044744,comentarios_misoginia,0,final_misoginia
comentario_1056654," -iy2ob  Como personalidade ele realmente é interessante.As ideias dele, discordo aos montes.Ele é inteligente mas 50% do que ele fala faz sentido, os outros 50% são preconceitos que ele tem baseados nas experiências de vida pessoais.Ainda assim, neste episódio ele mais atrapalharia do que somaria.",0,0," -iy2ob  Como personalidade ele realmente é interessante.As ideias dele, discordo aos montes.Ele é inteligente mas 50% do que ele fala faz sentido, os outros 50% são preconceitos que ele tem baseados nas experiências de vida pessoais.Ainda assim, neste episódio ele mais atrapalharia do que somaria.",0.104795754,0.12089061737060547,0.104795754,0.0020313263,0.011617327,0.03522326,comentarios_misoginia,0,final_misoginia
comentario_1121684,"A verdadeira doutrina ,q seja eterrna esse tipo de educação e conselho, parabéns mamãe",0,0,"A verdadeira doutrina ,q seja eterrna esse tipo de educação e conselho, parabéns mamãe",0.017592486,0.11853432655334473,0.017592486,0.00066280365,0.0013689207,0.0140109155,comentarios_misoginia,0,final_misoginia
