id_comentario_anonimizado,comentario,final_misoginia,final_toxicidade,texto_analise,score_perspective_max,latencia_api,detalhe_toxicity,detalhe_severe,detalhe_identity,detalhe_insult,tipo_origem,unified_label,original_label_column
comentario_1668771,"Deixa eu falar uma coisa pro dono do canal,olha muita coisa eu concordo com vc,mas de verdade tem vídeo que acusa uma mulher sem nem siquer conhece-la,infelizmente pra vcs nenhuma presta,poxa vamos ter um pouco de prudência e nao acuse sem saber a verdade das pessoas,ja parou pra pensar que essa mulher pode ter tido duvidas em relacao ao cara,o modo em que tratava ela ou etc...e depois sei la ela percebeu que o que ele tinha nao era tao ruim assim a ponto de terminar?AS PESSOAS ERRAM E NEM PORISSO SAIAM POR AI TRANSANDO ,DA UMA RAIVA DISSO,HOJE TA ASSIM LARGOU TRAIU!POXA SOU CASADA A 18 ANOS FIEL E MEU MARIDO ME RESPEITA SOMOS FELIZES E TEMOS 3 FILHOS,SOMOS IGUAL NAMORADOS,MAS MUITAS VEZES NO COMEÇO DE RELACIONAMENTO NAO TEMOS MATURIDADE PRA ENTENDER AS COISAS COMO DEPOIS DE ANOS,ENFIM NAO DESMERECAM E NEM ACUSEM SEM CONHECER!CUIDADO COM ACUSAÇÕES SEM PROVAS!!",0,0,"Deixa eu falar uma coisa pro dono do canal,olha muita coisa eu concordo com vc,mas de verdade tem vídeo que acusa uma mulher sem nem siquer conhece-la,infelizmente pra vcs nenhuma presta,poxa vamos ter um pouco de prudência e nao acuse sem saber a verdade das pessoas,ja parou pra pensar que essa mulher pode ter tido duvidas em relacao ao cara,o modo em que tratava ela ou etc...e depois sei la ela percebeu que o que ele tinha nao era tao ruim assim a ponto de terminar?AS PESSOAS ERRAM E NEM PORISSO SAIAM POR AI TRANSANDO ,DA UMA RAIVA DISSO,HOJE TA ASSIM LARGOU TRAIU!POXA SOU CASADA A 18 ANOS FIEL E MEU MARIDO ME RESPEITA SOMOS FELIZES E TEMOS 3 FILHOS,SOMOS IGUAL NAMORADOS,MAS MUITAS VEZES NO COMEÇO DE RELACIONAMENTO NAO TEMOS MATURIDADE PRA ENTENDER AS COISAS COMO DEPOIS DE ANOS,ENFIM NAO DESMERECAM E NEM ACUSEM SEM CONHECER!CUIDADO COM ACUSAÇÕES SEM PROVAS!!",0.2820025,0.16758489608764648,0.2820025,0.019740647,0.04280826,0.24928534,comentarios_misoginia,0,final_misoginia
comentario_2126671,"Podem me chamar de estranha , egoísta,  antiquada,  enfim ... Não confio , não abuso e não dou abertura pois se algo acontecer não foi culpa minha e assim sendo  , só  seguir minha vida 😘",0,0,"Podem me chamar de estranha , egoísta,  antiquada,  enfim ... Não confio , não abuso e não dou abertura pois se algo acontecer não foi culpa minha e assim sendo  , só  seguir minha vida 😘",0.19124292,0.1562662124633789,0.19124292,0.004386902,0.010803374,0.13245803,comentarios_misoginia,0,final_misoginia
comentario_1142513,Aposto que o sonho do filho é que os pais voltem a ficar juntos e felizes.,0,0,Aposto que o sonho do filho é que os pais voltem a ficar juntos e felizes.,0.005351613,0.158538818359375,0.0020262774,0.00011920929,0.00031679415,0.005351613,comentarios_misoginia,0,final_misoginia
comentario_1371566,"Meu genro assumiu meu neto de dois anos, que agora tem 19 e tem um menino de 2 anos com minha filha. São muito felizes. Meu neto ama muito mais do que ama o pai biológico e meu genro o ama mais que muitos pais biológicos. Eu e minha esposa amamos e respeitamos muito nosso genro. Não é filho, e relação, laço e amor que contam",0,0,"Meu genro assumiu meu neto de dois anos, que agora tem 19 e tem um menino de 2 anos com minha filha. São muito felizes. Meu neto ama muito mais do que ama o pai biológico e meu genro o ama mais que muitos pais biológicos. Eu e minha esposa amamos e respeitamos muito nosso genro. Não é filho, e relação, laço e amor que contam",0.016712861,0.13053321838378906,0.016712861,0.001206398,0.0065486208,0.008994885,comentarios_misoginia,0,final_misoginia
comentario_932369,Estava interessado em outras!!!😂,0,0,Estava interessado em outras!!!😂,0.007979449,0.10553598403930664,0.007979449,0.00045776367,0.0011839314,0.007170874,comentarios_misoginia,0,final_misoginia
comentario_444940,"  1° Ninguém quer ir visitar uma mulher q conversa do tipo dessa do vídeo ...duvido q  ela tem colegas q se oferecem p ir na casa dela ...talvez é ao contrário e sim é ela q quer ir na casa dos outros ...O q aontece é o seguinte ...Na adolescência.... acabamos d sair da infância ...somos mais inocentes...temos mais tempo ...temos mais necessidade de falar ... de conversar ...confiamos mais ...C o passar do tempo ...vamos vendo q as pessoas são egoístas, algumas  hipócritas ... e isso até entre irmãos ou primos ....as vezes até temos pai , mãe q não são confiáveis ..isso desde o princípio da vida ...Inclusive o certo seria primeiro sermos amigos dos irmãos , primos , tios e depois vim as pessoas da rua ...depois vim os colegas ...mais não é assim não ..e isso é desde o princípio do mundo ... Não teve a história de Abel e Caim ...O q ela falou sobre gastar ... $$ churrasco, banquete p se aparecer .....isso aí depende do q os colegas combinam ...Outra coisa a vida financeira cada um cuida da sua ...cada um cuida das suas finanças ....cada um tem q ter sabedoria e buscar se qualificar profissionalmente... seja virar um bom catador d reciclagem ou fazer um curso superior ou técnico ou um excelente pintor , padeiro , salgadeiro , cabeleireiro, costureiro ...o certo é economizar e viver d acordo com o q ganha ..a vida financeira é cada um por si mesmo ...Quem é comprometido as vezes já não tem muito tempo nem p cônjuge, nem p filhos ...tem q tirar tempo p ligar , visitar mãe , avó ...Casa , lar é sagrado ...ocupações, responsabilidades durante a semana...provavelmente feriado, sábado são p descansar ..Quem tem alguém q confia p desabafar , p comemorar...tem pessoas q uma motivação a outro c as palavras...conheço pessoas q são cristãos... e q tem temor d Deus e amor , respeito e q se preocupam uns c os outros ...quem tem colegas q da p confiar.... são pessoas d sorte ...Dependendo da idade ...a pessoa está *sedentária* .. _desmotivada_ ... *sem* sonhos e por isso fica igual essa mulher do vídeo ...essa mulher do vídeo está gorda ...não malha , não treina ...alimenta mal ...está inflamada de trigo , pão , bolo , macarrão, doces ...farinhas brancas q viram açúcar no organismo ...Esperar o q ???",1,1,"  1° Ninguém quer ir visitar uma mulher q conversa do tipo dessa do vídeo ...duvido q  ela tem colegas q se oferecem p ir na casa dela ...talvez é ao contrário e sim é ela q quer ir na casa dos outros ...O q aontece é o seguinte ...Na adolescência.... acabamos d sair da infância ...somos mais inocentes...temos mais tempo ...temos mais necessidade de falar ... de conversar ...confiamos mais ...C o passar do tempo ...vamos vendo q as pessoas são egoístas, algumas  hipócritas ... e isso até entre irmãos ou primos ....as vezes até temos pai , mãe q não são confiáveis ..isso desde o princípio da vida ...Inclusive o certo seria primeiro sermos amigos dos irmãos , primos , tios e depois vim as pessoas da rua ...depois vim os colegas ...mais não é assim não ..e isso é desde o princípio do mundo ... Não teve a história de Abel e Caim ...O q ela falou sobre gastar ... $$ churrasco, banquete p se aparecer .....isso aí depende do q os colegas combinam ...Outra coisa a vida financeira cada um cuida da sua ...cada um cuida das suas finanças ....cada um tem q ter sabedoria e buscar se qualificar profissionalmente... seja virar um bom catador d reciclagem ou fazer um curso superior ou técnico ou um excelente pintor , padeiro , salgadeiro , cabeleireiro, costureiro ...o certo é economizar e viver d acordo com o q ganha ..a vida financeira é cada um por si mesmo ...Quem é comprometido as vezes já não tem muito tempo nem p cônjuge, nem p filhos ...tem q tirar tempo p ligar , visitar mãe , avó ...Casa , lar é sagrado ...ocupações, responsabilidades durante a semana...provavelmente feriado, sábado são p descansar ..Quem tem alguém q confia p desabafar , p comemorar...tem pessoas q uma motivação a outro c as palavras...conheço pessoas q são cristãos... e q tem temor d Deus e amor , respeito e q se preocupam uns c os outros ...quem tem colegas q da p confiar.... são pessoas d sorte ...Dependendo da idade ...a pessoa está *sedentária* .. _desmotivada_ ... *sem* sonhos e por isso fica igual essa mulher do vídeo ...essa mulher do vídeo está gorda ...não malha , não treina ...alimenta mal ...está inflamada de trigo , pão , bolo , macarrão, doces ...farinhas brancas q viram açúcar no organismo ...Esperar o q ???",0.36095104,0.09974193572998047,0.36095104,0.023076924,0.054763943,0.26957804,comentarios_misoginia,1,final_misoginia
comentario_845546,Por isso falo: amor é lorota quem manda é a nota,0,0,Por isso falo: amor é lorota quem manda é a nota,0.08795626,0.06664466857910156,0.08795626,0.0023937225,0.00449524,0.032138187,comentarios_misoginia,0,final_misoginia
comentario_17710,Sai fora dessa mulher rapaz!! Isso é  preguiça pura.,1,1,Sai fora dessa mulher rapaz!! Isso é  preguiça pura.,0.45135358,0.10691595077514648,0.39441586,0.023076924,0.10757765,0.45135358,comentarios_misoginia,1,final_misoginia
comentario_2748577,a mulher é Sub-Five e ainda tá fazendo exigência! essa daí eu não pego nem de graça!..🤣🤣🤣,1,1,a mulher é Sub-Five e ainda tá fazendo exigência! essa daí eu não pego nem de graça!..🤣🤣🤣,0.3286776,0.10281229019165039,0.3286776,0.017481172,0.2764353,0.27146968,comentarios_misoginia,1,final_misoginia
comentario_2590279,Este procedimento não chega a custar nem Rs500 em qq estado do Brasil! Pq ele menciona Rs2.500?,0,0,Este procedimento não chega a custar nem Rs500 em qq estado do Brasil! Pq ele menciona Rs2.500?,0.007987879,0.10732102394104004,0.0070055793,0.00024914742,0.00077233027,0.007987879,comentarios_misoginia,0,final_misoginia
comentario_18382,"Mas também muitos homens estão procurando mulheres perfeitas, velhos procurando novinhas,  acho que a culpa é de todos",0,0,"Mas também muitos homens estão procurando mulheres perfeitas, velhos procurando novinhas,  acho que a culpa é de todos",0.16158698,0.0802760124206543,0.16158698,0.008583069,0.10221587,0.07270074,comentarios_misoginia,0,final_misoginia
comentario_2265724,"Fique a vontade, eu sai da plantação e não retorno nunca mais, nem sobe ameaça do estado ou seja o que for.",0,0,"Fique a vontade, eu sai da plantação e não retorno nunca mais, nem sobe ameaça do estado ou seja o que for.",0.027442247,0.15505433082580566,0.027442247,0.0012683868,0.0021088778,0.012224905,comentarios_misoginia,0,final_misoginia
comentario_663521,Passa toda minha vida eterna com cristo,0,0,Passa toda minha vida eterna com cristo,0.031449065,0.1111593246459961,0.031449065,0.002670288,0.011247349,0.010476895,comentarios_misoginia,0,final_misoginia
comentario_2961541,"Mais do que estado de paz, é libertador, isso não tem preço, tem valor...",0,0,"Mais do que estado de paz, é libertador, isso não tem preço, tem valor...",0.01225191,0.11775922775268555,0.01225191,0.0006532669,0.0016371552,0.009393888,comentarios_misoginia,0,final_misoginia
comentario_3012854,"sabe o que é engraçado? É que eu vejo sinceridade no pensamento de muita deusa rara como essa daí. Elas realmente parece que não fazem a menor ideia do porque do ghosting. Eu achava que era tão óbvio que elas se faziam de desentendidas, mas não, parece que elas realmente ficam pensando que é por algum motivo muitoooo especial quando na verdade é algo tão simples quanto: ""já desbeicei essa, próxima!!!"". Tipo, isso é tão claro como água cristalina pra nós e elas não conseguem nem imaginar, eu te juro que eu achava que no fundo elas sabiam. Talvez saibam né, no fundo talvez saibam, mas ficam usando essas coisas pra tentar amenizar a consciência de si mesmas e umas das outras",1,1,"sabe o que é engraçado? É que eu vejo sinceridade no pensamento de muita deusa rara como essa daí. Elas realmente parece que não fazem a menor ideia do porque do ghosting. Eu achava que era tão óbvio que elas se faziam de desentendidas, mas não, parece que elas realmente ficam pensando que é por algum motivo muitoooo especial quando na verdade é algo tão simples quanto: ""já desbeicei essa, próxima!!!"". Tipo, isso é tão claro como água cristalina pra nós e elas não conseguem nem imaginar, eu te juro que eu achava que no fundo elas sabiam. Talvez saibam né, no fundo talvez saibam, mas ficam usando essas coisas pra tentar amenizar a consciência de si mesmas e umas das outras",0.27047762,0.10776233673095703,0.27047762,0.013736901,0.0543092,0.16795322,comentarios_misoginia,1,final_misoginia
comentario_1897457,O manginismo é uma doença gravíssima,1,1,O manginismo é uma doença gravíssima,0.40243408,0.10741472244262695,0.4014846,0.02458496,0.40158966,0.40243408,comentarios_misoginia,1,final_misoginia
comentario_1795097,"Mas tem muitos que assediam via internet também São inconvenientes, mandam foto do penis sem ninguém pedir, stalkeiam, só mudou a forma de abordar",0,0,"Mas tem muitos que assediam via internet também São inconvenientes, mandam foto do penis sem ninguém pedir, stalkeiam, só mudou a forma de abordar",0.36456755,0.10096359252929688,0.36456755,0.023076924,0.026810925,0.18480228,comentarios_misoginia,0,final_misoginia
comentario_1165876,"E voltar com o Miliciano e o Jegues, não,  ",0,0,"E voltar com o Miliciano e o Jegues, não,  ",0.037105743,0.12807273864746094,0.037105743,0.0016880035,0.0068446035,0.025026767,comentarios_misoginia,0,final_misoginia
comentario_345810,Fez naiir escândalo qdo Wanessa tocou no seu pé..,0,0,Fez naiir escândalo qdo Wanessa tocou no seu pé..,0.11347008,0.16683244705200195,0.11347008,0.0049972534,0.004920715,0.04852104,comentarios_misoginia,0,final_misoginia
comentario_1659421,"Duvido uma mulher linda e atlética vc ia querer mesmo treinando junto com seu marido... Aliás,  acho personal inútil,  na academia já tem instrutor/professor, e ao ar livre vc pode praticar uma corrida,  alongamento, barra.... Não vejo o porquê da necessidade de personal, pra fazer exercício complexo?? 🤷🏻‍♀️🤷🏻‍♀️",0,0,"Duvido uma mulher linda e atlética vc ia querer mesmo treinando junto com seu marido... Aliás,  acho personal inútil,  na academia já tem instrutor/professor, e ao ar livre vc pode praticar uma corrida,  alongamento, barra.... Não vejo o porquê da necessidade de personal, pra fazer exercício complexo?? 🤷🏻‍♀️🤷🏻‍♀️",0.11479026,0.14264631271362305,0.11479026,0.004005432,0.019274252,0.077136256,comentarios_misoginia,0,final_misoginia
comentario_2033808,KKK branca de neve do inferno corre vaso isso foi livramento 😂😂😂,1,1,KKK branca de neve do inferno corre vaso isso foi livramento 😂😂😂,0.54823303,0.10863780975341797,0.54823303,0.23225145,0.44690517,0.36021477,comentarios_misoginia,1,final_misoginia
comentario_352122,"Acho que é pior, o Campari ainda era zoado por alguns (devido a aparência) esse é muito elogiado.",0,0,"Acho que é pior, o Campari ainda era zoado por alguns (devido a aparência) esse é muito elogiado.",0.039226998,0.15610837936401367,0.039226998,0.0012397766,0.0029228306,0.021094928,comentarios_misoginia,0,final_misoginia
comentario_191440,Isso daí são tipos de mulher que precisa de atenção dos homens.mulher não precisa disso pra chamar atenção,1,1,Isso daí são tipos de mulher que precisa de atenção dos homens.mulher não precisa disso pra chamar atenção,0.33060804,0.1703805923461914,0.27750343,0.016319158,0.33060804,0.1669316,comentarios_misoginia,1,final_misoginia
comentario_76678,"Esse Daniel é um mentiroso, daqueles crentes que em tudo vé conspiração",0,1,"Esse Daniel é um mentiroso, daqueles crentes que em tudo vé conspiração",0.5208188,0.11802458763122559,0.4398409,0.020257099,0.10221587,0.5208188,comentarios_misoginia,0,final_misoginia
comentario_269847,Que dama de mulher empoderada e que ela crá faz errado ninguém vergonha as outras agora se você quer ensinar o que é certo e fazer e honrar as mulheres faz correto faz certo ensina o que é certo seja uma mulher de valor de verdade parabéns ao homem aí falou sério falou correto e foi homem pra assumir Tanto o que desvalorizada a ele como o que valoriza foi correto isso é ser homem isso é valorizar a sua classe,1,1,Que dama de mulher empoderada e que ela crá faz errado ninguém vergonha as outras agora se você quer ensinar o que é certo e fazer e honrar as mulheres faz correto faz certo ensina o que é certo seja uma mulher de valor de verdade parabéns ao homem aí falou sério falou correto e foi homem pra assumir Tanto o que desvalorizada a ele como o que valoriza foi correto isso é ser homem isso é valorizar a sua classe,0.059479803,0.10101985931396484,0.059479803,0.0022125244,0.014852738,0.03566399,comentarios_misoginia,1,final_misoginia
comentario_816338,Pegou uma foto da dona Joselma que não favorece muito  kkkk porque tem ela na fotoRodou com pneu murcho,0,1,Pegou uma foto da dona Joselma que não favorece muito  kkkk porque tem ela na fotoRodou com pneu murcho,0.20219094,0.11409401893615723,0.20219094,0.01302678,0.037136484,0.15769513,comentarios_misoginia,0,final_misoginia
comentario_1360608,"Sou da capital de São Paulo, e penso em sair dessa cidade.",0,0,"Sou da capital de São Paulo, e penso em sair dessa cidade.",0.005897866,0.1596081256866455,0.002450382,0.00027537346,0.0011700572,0.005897866,comentarios_misoginia,0,final_misoginia
comentario_89233,Nao peguei ranço pq to pouco me fodendo pra vidas alheias ainda mais de famosos que nem sabem que eu existo nao ganho nada com isso entao pra mim nao fede nem cheira da mesma forma que os mesmo pensam de nos.,0,0,Nao peguei ranço pq to pouco me fodendo pra vidas alheias ainda mais de famosos que nem sabem que eu existo nao ganho nada com isso entao pra mim nao fede nem cheira da mesma forma que os mesmo pensam de nos.,0.47886392,0.1055147647857666,0.47886392,0.16960317,0.061130337,0.36798462,comentarios_misoginia,0,final_misoginia
comentario_469290,Resumindo nós homens temos muito quê aprender e deixar de ser trouxa...,0,0,Resumindo nós homens temos muito quê aprender e deixar de ser trouxa...,0.24603334,0.11403107643127441,0.24603334,0.011062622,0.10221587,0.20201176,comentarios_misoginia,0,final_misoginia
comentario_836375,"Onde moro não tem Carnaval, mas uns fresco de fora estão trazendo uns bloquinho para aqui Affs, os bostileiros QI 83 se multiplicam rapidamente, chegaram nas bandas de cá.Que nojo, tudo chinelões.",0,1,"Onde moro não tem Carnaval, mas uns fresco de fora estão trazendo uns bloquinho para aqui Affs, os bostileiros QI 83 se multiplicam rapidamente, chegaram nas bandas de cá.Que nojo, tudo chinelões.",0.40243408,0.0995185375213623,0.3625127,0.023076924,0.14019285,0.40243408,comentarios_misoginia,0,final_misoginia
comentario_1357321,E tem mulher que acha que tá abalando quando anda assim ... sendo que na vdd tá ridícula,1,1,E tem mulher que acha que tá abalando quando anda assim ... sendo que na vdd tá ridícula,0.48627716,0.11016464233398438,0.43475235,0.023076924,0.28034934,0.48627716,comentarios_misoginia,1,final_misoginia
comentario_2452512,Sinais. Sinais. Os pais já captaram isso.  O jovem Miquéia Crefisa está apaixonado e ignorando os alertas de perigo.,0,0,Sinais. Sinais. Os pais já captaram isso.  O jovem Miquéia Crefisa está apaixonado e ignorando os alertas de perigo.,0.1013248,0.10913228988647461,0.1013248,0.0019454956,0.010433395,0.0623257,comentarios_misoginia,0,final_misoginia
comentario_2496768,Poderia dar os créditos dos vídeos que usa no canal.,0,0,Poderia dar os créditos dos vídeos que usa no canal.,0.0064108693,0.10973763465881348,0.0063144458,0.0005197525,0.001276426,0.0064108693,comentarios_misoginia,0,final_misoginia
comentario_1213387,"Mas se é um homem que fala essas coisas, é massacrado... muitas vezes até pelos próprios homens.",0,0,"Mas se é um homem que fala essas coisas, é massacrado... muitas vezes até pelos próprios homens.",0.006999873,0.09933900833129883,0.0045866123,0.000436306,0.00089719804,0.006999873,comentarios_misoginia,0,final_misoginia
comentario_1049712,"Femina consegue o que deseja e mantém o relacionamento.Feminista: consegue o ""empoderamento""  na dogpill quando ficar velha  e metralhada.",1,1,"Femina consegue o que deseja e mantém o relacionamento.Feminista: consegue o ""empoderamento""  na dogpill quando ficar velha  e metralhada.",0.47384647,0.12871003150939941,0.43965456,0.16960317,0.44690517,0.47384647,comentarios_misoginia,1,final_misoginia
comentario_2510753,"Só pela ""carinha"" dela já dá pra saber que de fato é uma armadilha. Abre o olho garoto",1,1,"Só pela ""carinha"" dela já dá pra saber que de fato é uma armadilha. Abre o olho garoto",0.2412222,0.10459113121032715,0.2412222,0.010223389,0.011839314,0.20668297,comentarios_misoginia,1,final_misoginia
comentario_285084,A ta Marmita de gringo ou Maria Passaporte,1,1,A ta Marmita de gringo ou Maria Passaporte,0.1100022,0.11382627487182617,0.1100022,0.005531311,0.039714564,0.061276767,comentarios_misoginia,1,final_misoginia
comentario_1922186,Ter mulher e assinar falência e atestado de óbito,1,1,Ter mulher e assinar falência e atestado de óbito,0.10739898,0.14594125747680664,0.10739898,0.0063705444,0.037136484,0.03511308,comentarios_misoginia,1,final_misoginia
comentario_657003,"FATO ! Mas nem todos percebe isso, lamentável",0,0,"FATO ! Mas nem todos percebe isso, lamentável",0.034277402,0.11052799224853516,0.034277402,0.00054836273,0.001951637,0.024640027,comentarios_misoginia,0,final_misoginia
comentario_39656,"Justiça é o que não existe nesse país, basta a mulher chegar chorando na delegacia que passa de agressora a vítima !",1,1,"Justiça é o que não existe nesse país, basta a mulher chegar chorando na delegacia que passa de agressora a vítima !",0.2854903,0.1282649040222168,0.2854903,0.017610285,0.23846684,0.25602314,comentarios_misoginia,1,final_misoginia
comentario_1733638,Se a mulher não  te ver como um prêmio ela não  se importará  com vc.,1,1,Se a mulher não  te ver como um prêmio ela não  se importará  com vc.,0.10826672,0.10293054580688477,0.10826672,0.0035476685,0.036878675,0.04149419,comentarios_misoginia,1,final_misoginia
comentario_2499793,"Eu não me arrependo de pagar uma   Só que isso tem que lá de vez em quando, senão você vicia",0,0,"Eu não me arrependo de pagar uma   Só que isso tem que lá de vez em quando, senão você vicia",0.0665887,0.1107177734375,0.0665887,0.0017642975,0.002192123,0.032799274,comentarios_misoginia,0,final_misoginia
comentario_929232,"Falo tudo, as mulheres acham que nós homens temos medo de ficar sozinhos, pior que ficar sozinho é viver no inferno dentro de um relacionamento.",1,1,"Falo tudo, as mulheres acham que nós homens temos medo de ficar sozinhos, pior que ficar sozinho é viver no inferno dentro de um relacionamento.",0.18364124,0.11160016059875488,0.18364124,0.016060932,0.12556632,0.07903719,comentarios_misoginia,1,final_misoginia
comentario_1121835,Se preparem para financiar mais uma família desestruturada.,0,0,Se preparem para financiar mais uma família desestruturada.,0.09481675,0.10925769805908203,0.09481675,0.0017166138,0.0042917514,0.04852104,comentarios_misoginia,0,final_misoginia
comentario_49947,"Contexto: ela é muito mais nova que ele. Apenas pela foto: dá uma bronca e continua. Em duas semanas,  povo já esqueceu.",0,0,"Contexto: ela é muito mais nova que ele. Apenas pela foto: dá uma bronca e continua. Em duas semanas,  povo já esqueceu.",0.034277402,0.12287425994873047,0.034277402,0.0010871887,0.0031633168,0.021546122,comentarios_misoginia,0,final_misoginia
comentario_694035,.9658  vai sustentar msol gadinho de valor kkk,1,1,.9658  vai sustentar msol gadinho de valor kkk,0.41168427,0.10358119010925293,0.41168427,0.101760045,0.20680901,0.26196828,comentarios_misoginia,1,final_misoginia
comentario_3029276,Cheguei mais rápido que modernete colocando short atolado pra ir no mercado com o Miqueias.,1,1,Cheguei mais rápido que modernete colocando short atolado pra ir no mercado com o Miqueias.,0.02343543,0.10560750961303711,0.02343543,0.0007915497,0.0016464046,0.015340924,comentarios_misoginia,1,final_misoginia
comentario_1555333,Eyta falta de caráter coitado desse marido,0,1,Eyta falta de caráter coitado desse marido,0.41530323,0.11602663993835449,0.37576625,0.023076924,0.035074018,0.41530323,comentarios_misoginia,0,final_misoginia
