id_comentario_anonimizado,comentario,final_misoginia,final_toxicidade,texto_analise,score_perspective_max,latencia_api,detalhe_toxicity,detalhe_severe,detalhe_identity,detalhe_insult,tipo_origem,unified_label,original_label_column
comentario_2910234,"@ -et8so ele não combina, só pede permissão antes de gravar kkkkkk",0,0,"@ -et8so ele não combina, só pede permissão antes de gravar kkkkkk",0.19599396,0.09907746315002441,0.19599396,0.008773804,0.014450782,0.039444692,comentarios_misoginia,0,final_misoginia
comentario_2328204,"Eu concordo! Não estou falando de educação respeitosa, mas sim onde os pais sabem se posicionar e mostrar autoridade, e realmente educar e preparar seus filhos para essa selva que chamamos de ""viver em sociedade"" kkk",0,0,"Eu concordo! Não estou falando de educação respeitosa, mas sim onde os pais sabem se posicionar e mostrar autoridade, e realmente educar e preparar seus filhos para essa selva que chamamos de ""viver em sociedade"" kkk",0.1460314,0.10919618606567383,0.1460314,0.009269714,0.06294931,0.06826523,comentarios_misoginia,0,final_misoginia
comentario_1882146,Olha se envolver com uma msol talvez já deu certo no passado mais agora com essa intoxicação feminista elas são as piores pq tem os filhos que podem ser usados na socioafetiva pra prejudicar os caras eu vi uma matéria que no Brasil o reconhecimento da paternidade socioafetiva cresceu 22% cuidado senhores,1,1,Olha se envolver com uma msol talvez já deu certo no passado mais agora com essa intoxicação feminista elas são as piores pq tem os filhos que podem ser usados na socioafetiva pra prejudicar os caras eu vi uma matéria que no Brasil o reconhecimento da paternidade socioafetiva cresceu 22% cuidado senhores,0.37082586,0.14320015907287598,0.34328604,0.023645958,0.37082586,0.3406697,comentarios_misoginia,1,final_misoginia
comentario_836429,"Acho q sou beta ceboso, tenho fobia social e percebo q isso me distância das pessoas, principalmente mulheres enfim tbm sou beta nerd sou terrível em esportes e sou calvo , gosto de falar de filmes, séries,animes e teorias da conspiração.Infelizmente isso é pouco a atraente para as minas",0,0,"Acho q sou beta ceboso, tenho fobia social e percebo q isso me distância das pessoas, principalmente mulheres enfim tbm sou beta nerd sou terrível em esportes e sou calvo , gosto de falar de filmes, séries,animes e teorias da conspiração.Infelizmente isso é pouco a atraente para as minas",0.25462922,0.1166238784790039,0.25462922,0.015931819,0.16373143,0.16337912,comentarios_misoginia,0,final_misoginia
comentario_2756954,"HOMENS, não se iludam com essas mulheres/feministas, narcisistas, tóxicas e abusivas atualmente, pois se você quiser ter sérios e graves problemas na sua vida, passar por situações idênticas e muito piores a que outros homens estão passando ou já passaram, se tornar refém, ter a sua vida transformada num caos, num calvário, num inferno, perder a sua paz, a sua sanidade mental, a sua tranquilidade, a sua qualidade de vida, sua saúde, suas forças, suas ótimas noites de sono, seu bem-estar, sua alegria de viver, seu sossego, a sua liberdade, seu dinheiro/patrimônio, sofrer falsas acusações e ainda poder ser preso. É muito fácil: seja mais um a cair no golpe do namoro firme, do ficar noivo, do morar juntos e do casamento. Não tem erro, a sua vida nunca mais será a mesma. Assim, além de sofrer horrores, você descobrirá pela dor o quanto ser um homem solteiro convicto é uma dádiva, é maravilhoso e é acima de tudo a suprema felicidade. A vida é feita de escolhas. Então, faça as suas!!! REDPILL AND MGTOW FOREVER.",1,1,"HOMENS, não se iludam com essas mulheres/feministas, narcisistas, tóxicas e abusivas atualmente, pois se você quiser ter sérios e graves problemas na sua vida, passar por situações idênticas e muito piores a que outros homens estão passando ou já passaram, se tornar refém, ter a sua vida transformada num caos, num calvário, num inferno, perder a sua paz, a sua sanidade mental, a sua tranquilidade, a sua qualidade de vida, sua saúde, suas forças, suas ótimas noites de sono, seu bem-estar, sua alegria de viver, seu sossego, a sua liberdade, seu dinheiro/patrimônio, sofrer falsas acusações e ainda poder ser preso. É muito fácil: seja mais um a cair no golpe do namoro firme, do ficar noivo, do morar juntos e do casamento. Não tem erro, a sua vida nunca mais será a mesma. Assim, além de sofrer horrores, você descobrirá pela dor o quanto ser um homem solteiro convicto é uma dádiva, é maravilhoso e é acima de tudo a suprema felicidade. A vida é feita de escolhas. Então, faça as suas!!! REDPILL AND MGTOW FOREVER.",0.44690517,0.11217689514160156,0.43475235,0.05742428,0.44690517,0.43296707,comentarios_misoginia,1,final_misoginia
comentario_439184,"Esquece, esses caras querem fica bonito na mídia, a legítima defesa ela não pode coexistir com o monopólio da violência estatal. Vc  não tem direito e sim concessão estatal.",0,0,"Esquece, esses caras querem fica bonito na mídia, a legítima defesa ela não pode coexistir com o monopólio da violência estatal. Vc  não tem direito e sim concessão estatal.",0.054284602,0.12303328514099121,0.054284602,0.0015354156,0.0063266335,0.028832749,comentarios_misoginia,0,final_misoginia
comentario_1844357,"Terrorismo na veia de homens que não sabem quem são, não sabem viver...",0,0,"Terrorismo na veia de homens que não sabem quem são, não sabem viver...",0.22043827,0.11131143569946289,0.22043827,0.014769804,0.10409598,0.16824563,comentarios_misoginia,0,final_misoginia
comentario_1497886,Ter marido sem caráter muito melhor fica só eles não melhoram não só perca de tempo !,0,0,Ter marido sem caráter muito melhor fica só eles não melhoram não só perca de tempo !,0.24928534,0.11259961128234863,0.2396185,0.0062179565,0.018771807,0.24928534,comentarios_misoginia,0,final_misoginia
comentario_585589,"Chegando lá,vai deitar e dormir😂",0,0,"Chegando lá,vai deitar e dormir😂",0.11419344,0.10537123680114746,0.11419344,0.0065994263,0.0040512653,0.029273475,comentarios_misoginia,0,final_misoginia
comentario_650457,"A primeira a ser machucada é a esposa chifruda que só não se sentirá machucada se não amar o marido e os filhos, claro, quando descobrirem o cafajeste do pai que têm e ficarem solidários com a dor da mãe 💥",0,1,"A primeira a ser machucada é a esposa chifruda que só não se sentirá machucada se não amar o marido e os filhos, claro, quando descobrirem o cafajeste do pai que têm e ficarem solidários com a dor da mãe 💥",0.36798462,0.11210465431213379,0.3389984,0.023927659,0.07508347,0.36798462,comentarios_misoginia,0,final_misoginia
comentario_1325041,"Gostei desse episódio e da convidada, ganhou mais um inscrito nas redes!",0,0,"Gostei desse episódio e da convidada, ganhou mais um inscrito nas redes!",0.005660365,0.12485480308532715,0.003754111,0.00029563904,0.00076770555,0.005660365,comentarios_misoginia,0,final_misoginia
comentario_1002073,"Só não entendi o rapaz com uma taça de vinho na mão, com essa cara sarcástica",0,0,"Só não entendi o rapaz com uma taça de vinho na mão, com essa cara sarcástica",0.071337044,0.14381074905395508,0.071337044,0.001373291,0.0036997858,0.039444692,comentarios_misoginia,0,final_misoginia
comentario_2304795,Não precisamos de religião. Os índios viviam muito bem sem essa porcaria.,0,0,Não precisamos de religião. Os índios viviam muito bem sem essa porcaria.,0.74954444,0.11390519142150879,0.74954444,0.16960317,0.5548181,0.6099415,comentarios_misoginia,0,final_misoginia
comentario_1289511,"Ela não tem motivos pra mandar ele embora, mais ele tem motivo pra ir embora. Mulher louca",1,1,"Ela não tem motivos pra mandar ele embora, mais ele tem motivo pra ir embora. Mulher louca",0.53014356,0.11688637733459473,0.44573322,0.021419114,0.1232452,0.53014356,comentarios_misoginia,1,final_misoginia
comentario_875802,"Ela foi internada, e foi comprovado que ela tem problemas mentais e toma até remédios controlado.Por que vcs estão tratando como se fosse uma falta de caráter  ???? 🤷🏾‍♂️🤷🏾‍♂️🤷🏾‍♂️🤷🏾‍♂️🤷🏾‍♂️🤷🏾‍♂️🤷🏾‍♂️🤷🏾‍♂️ Doença é uma questão de caráter  ?????? Vcs que sujam a imagem da redphill.",0,1,"Ela foi internada, e foi comprovado que ela tem problemas mentais e toma até remédios controlado.Por que vcs estão tratando como se fosse uma falta de caráter  ???? 🤷🏾‍♂️🤷🏾‍♂️🤷🏾‍♂️🤷🏾‍♂️🤷🏾‍♂️🤷🏾‍♂️🤷🏾‍♂️🤷🏾‍♂️ Doença é uma questão de caráter  ?????? Vcs que sujam a imagem da redphill.",0.36798462,0.13738656044006348,0.32712606,0.012833111,0.039714564,0.36798462,comentarios_misoginia,0,final_misoginia
comentario_1662657,"Os homens podem sofrer todo tipo de violência no Brasil e não tem proteção estatal , realmente não está dando pra viver no Brasil . Além da carga tributária e este socialismo que aí está tem estas leis sexistas e misândricas que não param de aprovar . É absurdo ! Este SC e Es são os estados onde fazem mais leis assim , estados feministas , realmente estou com ranso mais ainda do Brasil !",0,1,"Os homens podem sofrer todo tipo de violência no Brasil e não tem proteção estatal , realmente não está dando pra viver no Brasil . Além da carga tributária e este socialismo que aí está tem estas leis sexistas e misândricas que não param de aprovar . É absurdo ! Este SC e Es são os estados onde fazem mais leis assim , estados feministas , realmente estou com ranso mais ainda do Brasil !",0.30502358,0.10741543769836426,0.30502358,0.020515325,0.28034934,0.26957804,comentarios_misoginia,0,final_misoginia
comentario_2018459,Melhor coisa: aplicar o dinheiro e pagar aluguel!,0,0,Melhor coisa: aplicar o dinheiro e pagar aluguel!,0.013005874,0.11104273796081543,0.013005874,0.0006389618,0.0011284347,0.009374888,comentarios_misoginia,0,final_misoginia
comentario_805163,A gente precisa mesmo e de Deus,0,0,A gente precisa mesmo e de Deus,0.013822667,0.11288881301879883,0.013822667,0.00096797943,0.005401687,0.008405882,comentarios_misoginia,0,final_misoginia
comentario_1643929,"Mulher tem obrigação de trabalhar, assim como o homem. Ninguém tem obrigação de sustentar ninguém.",0,0,"Mulher tem obrigação de trabalhar, assim como o homem. Ninguém tem obrigação de sustentar ninguém.",0.020960633,0.12317037582397461,0.020960633,0.0009965897,0.011617327,0.011122898,comentarios_misoginia,0,final_misoginia
comentario_2784648,"O pior de tudo mano as vezes agente dá de tudo ah uma mulher até msm sem poder só pra agradar, mas vem outro que nunca deu ah ela nem um chiclete, e ela traí o marido e ainda quer que agente perdoa ponto final Fim sem choro.",1,1,"O pior de tudo mano as vezes agente dá de tudo ah uma mulher até msm sem poder só pra agradar, mas vem outro que nunca deu ah ela nem um chiclete, e ela traí o marido e ainda quer que agente perdoa ponto final Fim sem choro.",0.2524482,0.10653829574584961,0.2524482,0.015221698,0.06476828,0.16839184,comentarios_misoginia,1,final_misoginia
comentario_2621922,"Quando voce estiver envelhecida, ele te troca por outra mais nova e mais bonita. Voce estara usada e ninguem vai querer, sem emprego e desvalorizada.  Hoje voce tem um preço. Mas e igual carro novo, depois de usado a gente troca por outro e o usado nao vale quase nada.Vai chorar amargamente por ter se sujeitado ao papel de rap....a e destruir um lar, sera tarde demais. Acorda e sai dessa vida, caminho para o inferno.",1,1,"Quando voce estiver envelhecida, ele te troca por outra mais nova e mais bonita. Voce estara usada e ninguem vai querer, sem emprego e desvalorizada.  Hoje voce tem um preço. Mas e igual carro novo, depois de usado a gente troca por outro e o usado nao vale quase nada.Vai chorar amargamente por ter se sujeitado ao papel de rap....a e destruir um lar, sera tarde demais. Acorda e sai dessa vida, caminho para o inferno.",0.38406035,0.11066317558288574,0.37751234,0.023076924,0.02138452,0.38406035,comentarios_misoginia,1,final_misoginia
comentario_2990439,Ficar como segunda opção  na vida de alguém  é  terrível! Quem te deixa nessa situação  não  merece nem ser descartado!Olhar pra trás  é  coisas de pessoas fracas!Deus é  a minha melhor opção!❤❤❤❤,0,0,Ficar como segunda opção  na vida de alguém  é  terrível! Quem te deixa nessa situação  não  merece nem ser descartado!Olhar pra trás  é  coisas de pessoas fracas!Deus é  a minha melhor opção!❤❤❤❤,0.103494145,0.10242438316345215,0.103494145,0.0032997131,0.0091384705,0.06302499,comentarios_misoginia,0,final_misoginia
comentario_1157017,Tá resolvido seu problema.pricyra um psiquiatra e se interna definitivamente.vc só precisa ser internada só isso,0,1,Tá resolvido seu problema.pricyra um psiquiatra e se interna definitivamente.vc só precisa ser internada só isso,0.34548226,0.10272359848022461,0.3389984,0.023076924,0.028418748,0.34548226,comentarios_misoginia,0,final_misoginia
comentario_1676800,@  Cuidado com o mecanismo da projeção! Kkk,0,0,@  Cuidado com o mecanismo da projeção! Kkk,0.13388206,0.10861754417419434,0.13388206,0.007209778,0.016259583,0.042665333,comentarios_misoginia,0,final_misoginia
comentario_267306,Kkkkk até eu queria ser filho desse pai Um bom pai sabe dar uma boa educação e o melhor ensinamento que ninguém vai dar .,0,0,Kkkkk até eu queria ser filho desse pai Um bom pai sabe dar uma boa educação e o melhor ensinamento que ninguém vai dar .,0.044141594,0.13567566871643066,0.044141594,0.0017642975,0.003866276,0.021803947,comentarios_misoginia,0,final_misoginia
comentario_2556544,"O padre me chamou atenção por ir de bermuda na igreja católica mas fora da igreja eu uso bermuda, sou muito infantil pois prefiro comprar action figure do que pagar jantar para futura esposa de alguém",0,0,"O padre me chamou atenção por ir de bermuda na igreja católica mas fora da igreja eu uso bermuda, sou muito infantil pois prefiro comprar action figure do que pagar jantar para futura esposa de alguém",0.10045706,0.16988754272460938,0.10045706,0.004043579,0.04306607,0.03335018,comentarios_misoginia,0,final_misoginia
comentario_1608440,"Nossa tadinho... Não foi escondido , pois vc já sabe. Sai fora se vc conseguir",0,0,"Nossa tadinho... Não foi escondido , pois vc já sabe. Sai fora se vc conseguir",0.1269396,0.1377427577972412,0.1269396,0.0035476685,0.0035887922,0.07555214,comentarios_misoginia,0,final_misoginia
comentario_353238,Não precisamos de homens pra nada! Vcs pediram NÓS VAMOS RESPEITAR!,0,0,Não precisamos de homens pra nada! Vcs pediram NÓS VAMOS RESPEITAR!,0.2854971,0.15984892845153809,0.2854971,0.012703998,0.27778897,0.16337912,comentarios_misoginia,0,final_misoginia
comentario_192846,"Eu queria tanto saber as fontes desse Jr... é uma metralhadora de ""fatos"" infundados. Tenho piedade da mulher que tentar ter algo com ele, com certeza será desrespeitada a torto e à direita. Ainda bem que achei meu homem que me respeita e concorda que esse papinho redpill é papo de virjão.",0,1,"Eu queria tanto saber as fontes desse Jr... é uma metralhadora de ""fatos"" infundados. Tenho piedade da mulher que tentar ter algo com ele, com certeza será desrespeitada a torto e à direita. Ainda bem que achei meu homem que me respeita e concorda que esse papinho redpill é papo de virjão.",0.38852,0.15178155899047852,0.3389984,0.008468628,0.021786476,0.38852,comentarios_misoginia,0,final_misoginia
comentario_1760077,"Mais claro que essa mensagem impossível, e p fechar com excelência, trecho do clube da luta , forte abraço Thomé , somos nós por nós mesmo!",0,0,"Mais claro que essa mensagem impossível, e p fechar com excelência, trecho do clube da luta , forte abraço Thomé , somos nós por nós mesmo!",0.0070758737,0.12195491790771484,0.006377276,0.00028967857,0.0009619443,0.0070758737,comentarios_misoginia,0,final_misoginia
comentario_2054586,Parabéns mulheronas empoderadas....,0,0,Parabéns mulheronas empoderadas....,0.06421452,0.11177611351013184,0.06421452,0.0032234192,0.028418748,0.029934563,comentarios_misoginia,0,final_misoginia
comentario_346975,Ela por si já viu que não dá certo com esse jovem. Só estava buscando no pai a certeza e ele deu. Parabéns pai!,0,0,Ela por si já viu que não dá certo com esse jovem. Só estava buscando no pai a certeza e ele deu. Parabéns pai!,0.0115029,0.11443138122558594,0.0109324735,0.00025629997,0.000638213,0.0115029,comentarios_misoginia,0,final_misoginia
comentario_956707,"Um homem com medo é como um poço sem fundo de amargura. Engraçado que esta geração de Pills não percebe nem quando homem é elogiado e apoiado. Tudo é manipulação para eles. Homem só pensa em custo - benefício sim. Ele também é interesseiro. E não tem só a ver com a parte financeira. É como ele funciona. Esse canal aqui é a prova disso: um punhado de homem desecantado que não tem onde investir o seu tempo a baixo custo e que acha que mulher deve servir e não exigir, ou seja, homem não quer risco de perder, só tirar vantagem. Eu pergunto, quanta mulher de ""carroucel"" teriam pegado se tivesse oportunidade? Suponho que todas. Aí tiravam vantagem, seriam piranhas mas davam benefícios. Mas como as piranhas estão exigindo algo em troca, aí já é diferente. Elas não merecem porque são piranhas. Não é uma questão de não querer piranha porque ela é imoral, é porque ela não quer ficar na desvantagem que dá jeito ao homem e representa ameaça para bolsa e reputação,  ou seja, dar pouco e receber muito, é a combinação perfeita para eles. Esta é a verdade. Agora, mulher séria também não quer ""chave"" gasta, oportunista, e cheia de vicios e traumas. Nem pensem que com essa atitude atraem alguém decente. Os homens devem preocupar-se em crescer não só a nivel financeiro, devem trabalhar o cérebro, a autoestima e a autonomia também. Deixem de ser emocionados de raiva reprimida e lutem por vocês.",1,1,"Um homem com medo é como um poço sem fundo de amargura. Engraçado que esta geração de Pills não percebe nem quando homem é elogiado e apoiado. Tudo é manipulação para eles. Homem só pensa em custo - benefício sim. Ele também é interesseiro. E não tem só a ver com a parte financeira. É como ele funciona. Esse canal aqui é a prova disso: um punhado de homem desecantado que não tem onde investir o seu tempo a baixo custo e que acha que mulher deve servir e não exigir, ou seja, homem não quer risco de perder, só tirar vantagem. Eu pergunto, quanta mulher de ""carroucel"" teriam pegado se tivesse oportunidade? Suponho que todas. Aí tiravam vantagem, seriam piranhas mas davam benefícios. Mas como as piranhas estão exigindo algo em troca, aí já é diferente. Elas não merecem porque são piranhas. Não é uma questão de não querer piranha porque ela é imoral, é porque ela não quer ficar na desvantagem que dá jeito ao homem e representa ameaça para bolsa e reputação,  ou seja, dar pouco e receber muito, é a combinação perfeita para eles. Esta é a verdade. Agora, mulher séria também não quer ""chave"" gasta, oportunista, e cheia de vicios e traumas. Nem pensem que com essa atitude atraem alguém decente. Os homens devem preocupar-se em crescer não só a nivel financeiro, devem trabalhar o cérebro, a autoestima e a autonomia também. Deixem de ser emocionados de raiva reprimida e lutem por vocês.",0.34757367,0.1049184799194336,0.34757367,0.018126737,0.1808059,0.33896056,comentarios_misoginia,1,final_misoginia
comentario_1444128,"Eu já vi video desse cara ai mandando essa mulher embora no Natal...ou estou enganado? As vozes e o Bio tipo é o mesmo, será que o cara perdoou daquela vez? Ou ela meteu chifre em outro? Ou armação?",0,0,"Eu já vi video desse cara ai mandando essa mulher embora no Natal...ou estou enganado? As vozes e o Bio tipo é o mesmo, será que o cara perdoou daquela vez? Ou ela meteu chifre em outro? Ou armação?",0.16043124,0.13948893547058105,0.16043124,0.0074386597,0.014551271,0.07428485,comentarios_misoginia,0,final_misoginia
comentario_1841178,"Ame a a si mesmo, antes de amar qualquer pessoa. O mandamento diz: ""ame ao seu próximo,  COMO A SI MESMO""",0,0,"Ame a a si mesmo, antes de amar qualquer pessoa. O mandamento diz: ""ame ao seu próximo,  COMO A SI MESMO""",0.011058134,0.11642932891845703,0.011058134,0.00040531158,0.0024233595,0.008652883,comentarios_misoginia,0,final_misoginia
comentario_3025063,"Todo mundo aqui nessa comunidade sabe que esse papo de mulher é caro é pra beta, normal e sub-five, quem é CHAD come sem gastar um Real e com poucas ideias.",1,1,"Todo mundo aqui nessa comunidade sabe que esse papo de mulher é caro é pra beta, normal e sub-five, quem é CHAD come sem gastar um Real e com poucas ideias.",0.26859093,0.12434816360473633,0.26859093,0.012703998,0.105836816,0.24928534,comentarios_misoginia,1,final_misoginia
comentario_1877275,tem mais leis vindo    so  esperar pra ver,0,0,tem mais leis vindo    so  esperar pra ver,0.016587202,0.09922599792480469,0.016587202,0.0010728836,0.0036627878,0.009526889,comentarios_misoginia,0,final_misoginia
comentario_2335606,E uma companheira ou é uma garota de programa?,0,0,E uma companheira ou é uma garota de programa?,0.009236055,0.14018583297729492,0.009236055,0.00039339066,0.001572409,0.0092228865,comentarios_misoginia,0,final_misoginia
comentario_488291,"Criei meu filhos assim e o pai deles me reclamava. Hoje meus filhos são cidadãos do bem e muito educados e muito elogiados, graças a Deus 🙏🙌❤️❤️❤️ O mais velho tem 39Do meio 38Mais novo 35. Graças a Deus 🙌🙏",0,0,"Criei meu filhos assim e o pai deles me reclamava. Hoje meus filhos são cidadãos do bem e muito educados e muito elogiados, graças a Deus 🙏🙌❤️❤️❤️ O mais velho tem 39Do meio 38Mais novo 35. Graças a Deus 🙌🙏",0.013445686,0.12076663970947266,0.013445686,0.0006914139,0.0021551251,0.010628895,comentarios_misoginia,0,final_misoginia
comentario_1586187,O que você faz de você não me interessa mas cuidado ao falar que é Cristã.  Respeito muito respeito  ao Cristianismo..,0,0,O que você faz de você não me interessa mas cuidado ao falar que é Cristã.  Respeito muito respeito  ao Cristianismo..,0.16678599,0.1076667308807373,0.16678599,0.0051498413,0.11396073,0.06319981,comentarios_misoginia,0,final_misoginia
comentario_2234041,"Minha mãe é mais homem do que esse pai😂😂😂 quando isso acontecia comigo e com minha irmã, ela já vinha na voadora 😂😂 minha irmã apanhava com o fio do ferro de passar. Eu já ficava pianinho só de ver ela apanhar.😂😂",0,1,"Minha mãe é mais homem do que esse pai😂😂😂 quando isso acontecia comigo e com minha irmã, ela já vinha na voadora 😂😂 minha irmã apanhava com o fio do ferro de passar. Eu já ficava pianinho só de ver ela apanhar.😂😂",0.25462922,0.10984516143798828,0.25462922,0.020127986,0.0440973,0.16266862,comentarios_misoginia,0,final_misoginia
comentario_2588225,"Cuidado, se a mulher personal for homossexual ou bi, vai dar em cima da sua Muié sem pudor, vai tomar chifre do mesmo jeito!",1,1,"Cuidado, se a mulher personal for homossexual ou bi, vai dar em cima da sua Muié sem pudor, vai tomar chifre do mesmo jeito!",0.46028158,0.13534760475158691,0.4402136,0.18232453,0.46028158,0.42881694,comentarios_misoginia,1,final_misoginia
comentario_1612266,"@  Exatamente, ambos os sexos possuem desejos e necessidades como eu disse, oque vejo é que homens e mulheres não estão sabendo lidar com as dificuldades de se relacionar e estão se tornando cada dia mais egocêntricos e egoístas sempre jogando a culpa no outro, sem assumir seus problemas, erros e defeitos.",0,0,"@  Exatamente, ambos os sexos possuem desejos e necessidades como eu disse, oque vejo é que homens e mulheres não estão sabendo lidar com as dificuldades de se relacionar e estão se tornando cada dia mais egocêntricos e egoístas sempre jogando a culpa no outro, sem assumir seus problemas, erros e defeitos.",0.21776234,0.10856366157531738,0.21776234,0.0074005127,0.18903255,0.14150882,comentarios_misoginia,0,final_misoginia
comentario_238824,"Falou pouco, mas falou bosta 😂 ..... Em resumo: homem tem que mover montanhas, mulher não precisa fazer nada",1,1,"Falou pouco, mas falou bosta 😂 ..... Em resumo: homem tem que mover montanhas, mulher não precisa fazer nada",0.39743927,0.1004645824432373,0.38811707,0.023317307,0.293411,0.39743927,comentarios_misoginia,1,final_misoginia
comentario_1956329,"Fora a falsidade e a pilantragem não tava tão ruim o trato. Tratando o cara bem, cuidando dele, demonstrando respeito e afeto inclusive publicamente. Se ela fizesse tudo isso que ela disse só que com um cara que ela gosta e admira, estaria super feliz em um relacionamento com todas as regalias. Mas prefere ser uma va****nda.",1,1,"Fora a falsidade e a pilantragem não tava tão ruim o trato. Tratando o cara bem, cuidando dele, demonstrando respeito e afeto inclusive publicamente. Se ela fizesse tudo isso que ela disse só que com um cara que ela gosta e admira, estaria super feliz em um relacionamento com todas as regalias. Mas prefere ser uma va****nda.",0.489133,0.09813475608825684,0.47622904,0.02378681,0.022590388,0.489133,comentarios_misoginia,1,final_misoginia
comentario_2314212,pois ela se sente presa é so ele da a carta de alforia pra ela ..que cada um procurar alguem que estar a seu nivel,1,1,pois ela se sente presa é so ele da a carta de alforia pra ela ..que cada um procurar alguem que estar a seu nivel,0.09828771,0.11405754089355469,0.09828771,0.0026893616,0.0059936526,0.030485468,comentarios_misoginia,1,final_misoginia
