id_comentario_anonimizado,comentario,final_misoginia,final_toxicidade,texto_analise,score_perspective_max,latencia_api,detalhe_toxicity,detalhe_severe,detalhe_identity,detalhe_insult,tipo_origem,unified_label,original_label_column
comentario_1389960,"Tem uma frase muito antiga q recomendo pesquisar sobre as origens das palavras pq tem muita coisa sabia a frase é "" ou vc morre herói ou viverá tempo o suficiente para se tornar vilão "" star wars Darth Vader a questão sobre o dinheiro e poder e o seguinte não é proibido ganhar o dinheiro e ser rico e q para ter tudo isso vem com um propósito e se vc se perder não vai cumprir e vai afetar a vida de muitos pode ser um patrão q explora seu empregado por exemplo o salário do empregado não da para ele viver com sua família e vc andando de Ferrari fazendo viagem pela Europa gastando em dólar em euro toda a riqueza q tira do Brasil do seu País deixando seu País na escassez para saciar seus luxos isso é pecado agora rei Salomão rei Davi os patriarca antigo ficou tudo rico ou era ricos e fez o propósito sem ligar para o dinheiro e sim a gerações a grande massa os desejos deles era insignificante perto da vida de muitos q ele influenciava entende não é pecado ser rico e sim como ganhou e o q vai fazer o uso dele vai ajudar ou vai fazer o mau ? Lembre se q enxergar e não ajudar e crime até na matéria imagina no espiritual o que e 90 anos no máximo todo sem energia q vai fazer com tanto dinheiro e poder se seu corpo Já não acompanha mais até seu espírito ao longo do tempo vai compreendendo e assim perde sua energia e não da mais tempo de terminar sua missão o q  realmente veio fazer na terceira dimensão matéria",0,0,"Tem uma frase muito antiga q recomendo pesquisar sobre as origens das palavras pq tem muita coisa sabia a frase é "" ou vc morre herói ou viverá tempo o suficiente para se tornar vilão "" star wars Darth Vader a questão sobre o dinheiro e poder e o seguinte não é proibido ganhar o dinheiro e ser rico e q para ter tudo isso vem com um propósito e se vc se perder não vai cumprir e vai afetar a vida de muitos pode ser um patrão q explora seu empregado por exemplo o salário do empregado não da para ele viver com sua família e vc andando de Ferrari fazendo viagem pela Europa gastando em dólar em euro toda a riqueza q tira do Brasil do seu País deixando seu País na escassez para saciar seus luxos isso é pecado agora rei Salomão rei Davi os patriarca antigo ficou tudo rico ou era ricos e fez o propósito sem ligar para o dinheiro e sim a gerações a grande massa os desejos deles era insignificante perto da vida de muitos q ele influenciava entende não é pecado ser rico e sim como ganhou e o q vai fazer o uso dele vai ajudar ou vai fazer o mau ? Lembre se q enxergar e não ajudar e crime até na matéria imagina no espiritual o que e 90 anos no máximo todo sem energia q vai fazer com tanto dinheiro e poder se seu corpo Já não acompanha mais até seu espírito ao longo do tempo vai compreendendo e assim perde sua energia e não da mais tempo de terminar sua missão o q  realmente veio fazer na terceira dimensão matéria",0.04785245,0.09180212020874023,0.04785245,0.0031089783,0.0042732526,0.028722567,comentarios_misoginia,0,final_misoginia
comentario_54234,Amém Jesus Cristo abençoe sempre vcs linda de mais ❤❤🎉,0,0,Amém Jesus Cristo abençoe sempre vcs linda de mais ❤❤🎉,0.0059358664,0.07294535636901855,0.0050578397,0.00051259995,0.0016094068,0.0059358664,comentarios_misoginia,0,final_misoginia
comentario_520202,"Ah, sim! Mas com toda certeza!",0,0,"Ah, sim! Mas com toda certeza!",0.014513801,0.11844301223754883,0.014513801,0.00081539154,0.0016834025,0.008614883,comentarios_misoginia,0,final_misoginia
comentario_1577025,Faz o L 😂😂😂 nunca mandei essa com tanto gosto 😂😂😂,0,0,Faz o L 😂😂😂 nunca mandei essa com tanto gosto 😂😂😂,0.09351514,0.10789799690246582,0.09351514,0.0038528442,0.0035332954,0.022448512,comentarios_misoginia,0,final_misoginia
comentario_2352402,A mulherada tem coragem de falar que homem nao presta kkkk olha o nível delas !,1,1,A mulherada tem coragem de falar que homem nao presta kkkk olha o nível delas !,0.40243408,0.1369786262512207,0.38811707,0.044870634,0.3817989,0.40243408,comentarios_misoginia,1,final_misoginia
comentario_836413,Obrigada por esse comentário irei seguir,0,0,Obrigada por esse comentário irei seguir,0.0069113337,0.10405993461608887,0.0069113337,0.000667572,0.001692652,0.0064108693,comentarios_misoginia,0,final_misoginia
comentario_1493875,"Também estou sim, acima da média.. reserve bem guardada!!",0,0,"Também estou sim, acima da média.. reserve bem guardada!!",0.008044879,0.125535249710083,0.0074453913,0.00034332275,0.0009526948,0.008044879,comentarios_misoginia,0,final_misoginia
comentario_123467,Mulher carente de atenção e porque é porque não tem,1,1,Mulher carente de atenção e porque é porque não tem,0.336253,0.10448074340820312,0.30136615,0.016383713,0.17847598,0.336253,comentarios_misoginia,1,final_misoginia
comentario_1460145,"Gente,é o cúmulo 💀 mais fácil n ter um relacionamento se for assim",0,0,"Gente,é o cúmulo 💀 mais fácil n ter um relacionamento se for assim",0.20032968,0.08546972274780273,0.20032968,0.0077819824,0.0075845607,0.08484049,comentarios_misoginia,0,final_misoginia
comentario_2404793,Ninguém mandou criar na mamata fazer oq,0,0,Ninguém mandou criar na mamata fazer oq,0.30527395,0.10811519622802734,0.30527395,0.023076924,0.016862517,0.19734058,comentarios_misoginia,0,final_misoginia
comentario_2969734,Na quebrada que eu moro 3 meses de namoro já vem o amado kkkk depois tem que pagar pensão 😢,0,0,Na quebrada que eu moro 3 meses de namoro já vem o amado kkkk depois tem que pagar pensão 😢,0.17285149,0.11255407333374023,0.17285149,0.01322045,0.039972372,0.07998765,comentarios_misoginia,0,final_misoginia
comentario_401925,"Alguns homens nos comentários falando que a mulher só presta se trabalhar em casa e que mulher que trabalhar fora trai homem. Aí depois vem aqui chorar que a carga fica só em cima dos homens. Nunca estão satisfeitos e provavelmente os mesmos que reclamam reclamam de tudo, mulher nenhuma quer, nunca estão felizes com o desejo da mulher, só com o que eles mesmo pensam. Francamente…..",0,0,"Alguns homens nos comentários falando que a mulher só presta se trabalhar em casa e que mulher que trabalhar fora trai homem. Aí depois vem aqui chorar que a carga fica só em cima dos homens. Nunca estão satisfeitos e provavelmente os mesmos que reclamam reclamam de tudo, mulher nenhuma quer, nunca estão felizes com o desejo da mulher, só com o que eles mesmo pensam. Francamente…..",0.2396185,0.07130169868469238,0.2396185,0.00919342,0.2308735,0.1640896,comentarios_misoginia,0,final_misoginia
comentario_2120606,Mas peter nunca lacrou nao pow.,0,0,Mas peter nunca lacrou nao pow.,0.03969839,0.13012051582336426,0.03969839,0.0012874603,0.0019238886,0.023995465,comentarios_misoginia,0,final_misoginia
comentario_79406,O delicado é viciado em fio terra.,0,1,O delicado é viciado em fio terra.,0.0049454854,0.11107754707336426,0.0005340576,3.2931566e-05,6.9660025e-05,0.0049454854,comentarios_misoginia,0,final_misoginia
comentario_1687219,"Tipo isso mesmo, na hora de arcar com as responsabilidades não tem pai, na hora de encher o saco está lá o bonito cheio de direitos 😂",0,0,"Tipo isso mesmo, na hora de arcar com as responsabilidades não tem pai, na hora de encher o saco está lá o bonito cheio de direitos 😂",0.30427247,0.1110081672668457,0.30427247,0.016254602,0.00984143,0.1505596,comentarios_misoginia,0,final_misoginia
comentario_1634401,"@ -fo4im sim. Mas você não sabe se é esse o ""motivo"" dele. Na maioria das vezes, são homens imaturos que não aguentam a responsabilidade de um casamento. Na minha humilde opinião, não deveriam nem namorar se não estão prontos para casar",0,1,"@ -fo4im sim. Mas você não sabe se é esse o ""motivo"" dele. Na maioria das vezes, são homens imaturos que não aguentam a responsabilidade de um casamento. Na minha humilde opinião, não deveriam nem namorar se não estão prontos para casar",0.3388922,0.10403871536254883,0.30716252,0.0065612793,0.10221587,0.3388922,comentarios_misoginia,0,final_misoginia
comentario_2466325,"  é o pensamento que os que fazem guerrinha de gênero quer que você acredite.Não se apegue a ideologias destrutivas que pregam a difamação do gênero feminino.Precisamos fazer reflexões sobre se realmente a mulher é o problema, precisamos pensar qual a parcela de culpa que o homem tem em tudo isso.Somos extensão um do outro, queira a sociedade acreditar ou não, essa é a verdade.",0,0,"  é o pensamento que os que fazem guerrinha de gênero quer que você acredite.Não se apegue a ideologias destrutivas que pregam a difamação do gênero feminino.Precisamos fazer reflexões sobre se realmente a mulher é o problema, precisamos pensar qual a parcela de culpa que o homem tem em tudo isso.Somos extensão um do outro, queira a sociedade acreditar ou não, essa é a verdade.",0.20149297,0.13702630996704102,0.20149297,0.005760193,0.1808059,0.07460167,comentarios_misoginia,0,final_misoginia
comentario_1761906,"Esses trinta dias é pouco, mas são esses dias que vai definir mudanca em sua vida.",0,0,"Esses trinta dias é pouco, mas são esses dias que vai definir mudanca em sua vida.",0.005061861,0.10972189903259277,0.0011230918,7.6293945e-05,0.00025089172,0.005061861,comentarios_misoginia,0,final_misoginia
comentario_2936901,Vai que a esposa é doida e te leve para terra dos pés juntos,0,1,Vai que a esposa é doida e te leve para terra dos pés juntos,0.40243408,0.1195528507232666,0.39644176,0.023364257,0.031206898,0.40243408,comentarios_misoginia,0,final_misoginia
comentario_1730564,Amo as Mulheres Comigo nunca Vai faltar a Madeirada nem o Pão é a Água .  os Homens  Envelhecem as Mulheres derretem Vamos vê a Vivi Fernandes na  Fazenda.,1,1,Amo as Mulheres Comigo nunca Vai faltar a Madeirada nem o Pão é a Água .  os Homens  Envelhecem as Mulheres derretem Vamos vê a Vivi Fernandes na  Fazenda.,0.200795,0.0939629077911377,0.200795,0.013801457,0.10221587,0.083112895,comentarios_misoginia,1,final_misoginia
comentario_1855866,Mas ele gosta é assim...bem safado e sujo do outro.Ainda aproveita os louros da divisão dos bens.,0,1,Mas ele gosta é assim...bem safado e sujo do outro.Ainda aproveita os louros da divisão dos bens.,0.43296707,0.10309910774230957,0.37751234,0.023076924,0.02138452,0.43296707,comentarios_misoginia,0,final_misoginia
comentario_2827367,Que bom seria se todas as crianças ouvissem esses conselhos com amor. Teríamos um mundo bem melhor. Parabéns Papai,0,0,Que bom seria se todas as crianças ouvissem esses conselhos com amor. Teríamos um mundo bem melhor. Parabéns Papai,0.008670582,0.12398314476013184,0.008670582,0.0006008148,0.0014984132,0.0072278744,comentarios_misoginia,0,final_misoginia
comentario_1672416,"@ -k7r6pentão você mesmo respondeu sua pergunta, É SORTE!!!",0,0,"@ -k7r6pentão você mesmo respondeu sua pergunta, É SORTE!!!",0.021667719,0.11401247978210449,0.021667719,0.0011968613,0.0021366263,0.010096892,comentarios_misoginia,0,final_misoginia
comentario_605353,"Sou autista,e a minha esposa fez isso comigo várias vezes,mas sempre a perdoei,estamos casados 40 anos, agora ela tá boazinha. Só ter paciência!😂😂😂😂",0,0,"Sou autista,e a minha esposa fez isso comigo várias vezes,mas sempre a perdoei,estamos casados 40 anos, agora ela tá boazinha. Só ter paciência!😂😂😂😂",0.091913216,0.10363268852233887,0.091913216,0.0048828125,0.031206898,0.03235855,comentarios_misoginia,0,final_misoginia
comentario_2156043,Pietra Bertolazzi é uma cristã admirável hoje. ❤,0,0,Pietra Bertolazzi é uma cristã admirável hoje. ❤,0.013508516,0.09079575538635254,0.013508516,0.0010824203,0.0073625734,0.007968879,comentarios_misoginia,0,final_misoginia
comentario_2794521,o ruim é quando a gente tenta e não da certo.,0,0,o ruim é quando a gente tenta e não da certo.,0.033334624,0.11786627769470215,0.033334624,0.00078201294,0.0023123662,0.014580919,comentarios_misoginia,0,final_misoginia
comentario_66012,"Ta mais que certa , olhamos e sabemos ali e so pra lanchar e pronto ! Se mexer muito da e problema. Com pu nao se envolve !",1,1,"Ta mais que certa , olhamos e sabemos ali e so pra lanchar e pronto ! Se mexer muito da e problema. Com pu nao se envolve !",0.09394901,0.10089635848999023,0.09394901,0.004558563,0.007954539,0.033790905,comentarios_misoginia,1,final_misoginia
comentario_1090620,"O que acontece de ruim na visão cristã não é culpa dele, pois o ser humano escolheu viver longe dele, e ele como nos Deus livre arbítrio, permitiu que nos entregassemos aos nossos prazeres, mas ele mesmo assim busca de aproximar dos seus filhos e etc... ",0,0,"O que acontece de ruim na visão cristã não é culpa dele, pois o ser humano escolheu viver longe dele, e ele como nos Deus livre arbítrio, permitiu que nos entregassemos aos nossos prazeres, mas ele mesmo assim busca de aproximar dos seus filhos e etc... ",0.1100022,0.1052699089050293,0.1100022,0.00333786,0.07425626,0.039151907,comentarios_misoginia,0,final_misoginia
comentario_1846658,YouTube e seus vídeo motivacionais kkkk,0,0,YouTube e seus vídeo motivacionais kkkk,0.32919475,0.07251596450805664,0.32919475,0.023076924,0.10815793,0.0836065,comentarios_misoginia,0,final_misoginia
comentario_2588704,"Pedreiro brincando, por baixo, é 10000 pra cima....bem na manha,,,,kkkk",0,0,"Pedreiro brincando, por baixo, é 10000 pra cima....bem na manha,,,,kkkk",0.085582085,0.09491872787475586,0.085582085,0.0035858154,0.004846719,0.04207976,comentarios_misoginia,0,final_misoginia
comentario_2809811,"E outra vc não tem que achar ND, deixa o cara viver a vida dele",0,0,"E outra vc não tem que achar ND, deixa o cara viver a vida dele",0.013948329,0.10698795318603516,0.013948329,0.0006389618,0.0014799143,0.008956885,comentarios_misoginia,0,final_misoginia
comentario_873750,Já estou seguindo ambos! 🙋🏻‍♂️🙋🏻‍♂️,0,0,Já estou seguindo ambos! 🙋🏻‍♂️🙋🏻‍♂️,0.0060783676,0.1022186279296875,0.0042096307,0.0003862381,0.0008648249,0.0060783676,comentarios_misoginia,0,final_misoginia
comentario_2553189,"Concordo plenamente Don Sandro, as atuais mulheres são extremamente perigosas, todo cuidado é pouco . Quanto aos feministos, o lugar deles na história é ó limbo !",1,1,"Concordo plenamente Don Sandro, as atuais mulheres são extremamente perigosas, todo cuidado é pouco . Quanto aos feministos, o lugar deles na história é ó limbo !",0.50588524,0.1048123836517334,0.47119883,0.043077253,0.50588524,0.48228607,comentarios_misoginia,1,final_misoginia
comentario_1103671,Querem tantas qualidades do sexo oposto mas na hora que se relaciona com alguém que preste elas próprias estragam com mimimi,1,1,Querem tantas qualidades do sexo oposto mas na hora que se relaciona com alguém que preste elas próprias estragam com mimimi,0.25462922,0.09419655799865723,0.25462922,0.0119018555,0.030175667,0.06494803,comentarios_misoginia,1,final_misoginia
comentario_2680768,Essa questão da habilitação vai criar uma nova lei trabalhista onde haverão cotas nas empresas de transportes para as mulheres (motoristas). O bom motorista já não servirá para mais nada.,1,1,Essa questão da habilitação vai criar uma nova lei trabalhista onde haverão cotas nas empresas de transportes para as mulheres (motoristas). O bom motorista já não servirá para mais nada.,0.08479069,0.12803888320922852,0.08479069,0.001373291,0.04512853,0.027347196,comentarios_misoginia,1,final_misoginia
comentario_436028,mulher contrariada é um perigo.,1,1,mulher contrariada é um perigo.,0.4830652,0.11263680458068848,0.43965456,0.023076924,0.4830652,0.3416952,comentarios_misoginia,1,final_misoginia
comentario_2297330,Imagino minha mãe tias vó e outras mulheres de valor vendo um negócio desses. Os homens que trazem a maioria dessas rodadas pra suas vidas estão pisando em granadas sem pino constantemente.,1,1,Imagino minha mãe tias vó e outras mulheres de valor vendo um negócio desses. Os homens que trazem a maioria dessas rodadas pra suas vidas estão pisando em granadas sem pino constantemente.,0.15103401,0.06452226638793945,0.15103401,0.006866455,0.052944973,0.06739554,comentarios_misoginia,1,final_misoginia
comentario_1286336,A tal maria da penha deveria ser presa,1,1,A tal maria da penha deveria ser presa,0.3666224,0.10231161117553711,0.3666224,0.023076924,0.04951127,0.36193377,comentarios_misoginia,1,final_misoginia
comentario_2478420,"Se uma mulher ficar com você na pobreza, ela merece tá com você na boneca .",0,0,"Se uma mulher ficar com você na pobreza, ela merece tá com você na boneca .",0.3140926,0.13259339332580566,0.3140926,0.023076924,0.11512129,0.27763805,comentarios_misoginia,0,final_misoginia
comentario_86884,"Chama o kim paim pra conversar mano. Depois voce consegue trazer o bolsonaro. Descola um pouco do mbl. O kim sabe muito sobre mbl, sergio moro, dalagnol e outros. Assim o seu canal cresce",0,0,"Chama o kim paim pra conversar mano. Depois voce consegue trazer o bolsonaro. Descola um pouco do mbl. O kim sabe muito sobre mbl, sergio moro, dalagnol e outros. Assim o seu canal cresce",0.1883923,0.1514894962310791,0.1883923,0.0075912476,0.015154205,0.083112895,comentarios_misoginia,0,final_misoginia
comentario_667173,"A mina é virgem, eita cara sortudo viu, isso é raro...",1,1,"A mina é virgem, eita cara sortudo viu, isso é raro...",0.23739935,0.10223674774169922,0.23739935,0.015221698,0.045901958,0.086852804,comentarios_misoginia,1,final_misoginia
comentario_1753540,Isso é bom demais kkkkkkQue venham mais vídeos deste.,0,0,Isso é bom demais kkkkkkQue venham mais vídeos deste.,0.045131154,0.12911677360534668,0.045131154,0.0052261353,0.008102531,0.013592913,comentarios_misoginia,0,final_misoginia
comentario_1405391,Sim. Dá pra ser feliz num casamento. Há 20 anos sim.,0,0,Sim. Dá pra ser feliz num casamento. Há 20 anos sim.,0.0067338715,0.10828495025634766,0.0065971822,0.000436306,0.0013411723,0.0067338715,comentarios_misoginia,0,final_misoginia
comentario_1980692,"Todo castigo pra essa lacradora ai é pouco, reseta a Km e volta a ser virgem com cirurgia, vai ver alguém quer. 😂😂😂😂",1,1,"Todo castigo pra essa lacradora ai é pouco, reseta a Km e volta a ser virgem com cirurgia, vai ver alguém quer. 😂😂😂😂",0.6109131,0.11086440086364746,0.51980776,0.19455661,0.09824528,0.6109131,comentarios_misoginia,1,final_misoginia
comentario_1090602,"Mano, às vezes ele está retribuindo de outra forma. 🤷🏼‍♂️",0,0,"Mano, às vezes ele está retribuindo de outra forma. 🤷🏼‍♂️",0.0665887,0.13443470001220703,0.0665887,0.0019359589,0.0018498929,0.023093075,comentarios_misoginia,0,final_misoginia
comentario_2727243,Só dá vontade de sorrir 😂😂😂😂😂😂😂😂😂😂😂😂,0,0,Só dá vontade de sorrir 😂😂😂😂😂😂😂😂😂😂😂😂,0.010681152,0.12830901145935059,0.010681152,0.0006580353,0.0011515582,0.0072088744,comentarios_misoginia,0,final_misoginia
comentario_2940064,"Eu livrei um grande amigo de fazer uma merda dessas,ainda bem que ele me ouviu e me agradece até hoje ,eu orientei ele a pegar uma doação vida sogra registrada no cartório com advogado e tudo ela se esquivou e se aborreceu ,a filha que era a noiva do meu amigo era rodada e mãe solteira eu avisei a ele construa no seu terreno e antes de casar e case com separação vital de bens e tenha cuidado com a prole dela pois vc pode virar tico tico e criar filho dos outros .ele até hoje me agradece pois o casamento não durou 2 anos",1,1,"Eu livrei um grande amigo de fazer uma merda dessas,ainda bem que ele me ouviu e me agradece até hoje ,eu orientei ele a pegar uma doação vida sogra registrada no cartório com advogado e tudo ela se esquivou e se aborreceu ,a filha que era a noiva do meu amigo era rodada e mãe solteira eu avisei a ele construa no seu terreno e antes de casar e case com separação vital de bens e tenha cuidado com a prole dela pois vc pode virar tico tico e criar filho dos outros .ele até hoje me agradece pois o casamento não durou 2 anos",0.36043653,0.1157987117767334,0.36043653,0.16233426,0.031464707,0.26957804,comentarios_misoginia,1,final_misoginia
comentario_2068988,"🤔 isso nem mi surpreende pode ser que muitos homens são assim mais isso é característica biologia de toda mulher nunca é bom o suficiente sempre querem mais... podem mi chamar de machista o que quiser, porém mentindo eu não estou.",1,1,"🤔 isso nem mi surpreende pode ser que muitos homens são assim mais isso é característica biologia de toda mulher nunca é bom o suficiente sempre querem mais... podem mi chamar de machista o que quiser, porém mentindo eu não estou.",0.37073207,0.10310220718383789,0.37073207,0.021290002,0.36702603,0.24287975,comentarios_misoginia,1,final_misoginia
comentario_2989985,Olhando pela 4 vez e nao entendi nada kkk,0,0,Olhando pela 4 vez e nao entendi nada kkk,0.042657252,0.0749521255493164,0.042657252,0.0030326843,0.0061046463,0.014732921,comentarios_misoginia,0,final_misoginia
comentario_2727628,@  eu moro no sul do país e veijo isso acontecer direto,0,0,@  eu moro no sul do país e veijo isso acontecer direto,0.043646812,0.11016535758972168,0.043646812,0.0024986267,0.014149316,0.013782915,comentarios_misoginia,0,final_misoginia
comentario_2955226,"Tatuagens esquisitas, esse monte de coleira colorida, apreço em demasia pelo dinheiro... tem coisas que são muito óbvias.",0,1,"Tatuagens esquisitas, esse monte de coleira colorida, apreço em demasia pelo dinheiro... tem coisas que são muito óbvias.",0.11912931,0.10868263244628906,0.11912931,0.0037574768,0.00828752,0.07396803,comentarios_misoginia,0,final_misoginia
comentario_1046244,"Exatamente, o intuito é criminalizar o litígio. Curiosamente, elas podem litigar por qualquer motivo e ainda mandar os filhos comuns tirarem fotos para comprovar o suposto estado econômico do ex-marido a fim de servir de prova para revisão de alimentos.",1,1,"Exatamente, o intuito é criminalizar o litígio. Curiosamente, elas podem litigar por qualquer motivo e ainda mandar os filhos comuns tirarem fotos para comprovar o suposto estado econômico do ex-marido a fim de servir de prova para revisão de alimentos.",0.041915078,0.0767664909362793,0.041915078,0.00096797943,0.0037737815,0.020192537,comentarios_misoginia,1,final_misoginia
comentario_410268,Fez o certo Tem meu respeito Já aconteceu comigo Mais foi com cuscuz 😂,0,0,Fez o certo Tem meu respeito Já aconteceu comigo Mais foi com cuscuz 😂,0.03357032,0.11675763130187988,0.03357032,0.0015830994,0.0035332954,0.017485369,comentarios_misoginia,0,final_misoginia
comentario_1907954,Coitado do miqueinha levando chifre 🤟🫎🫎🫎🤘🤘🤘a muito tempo e não percebeu e vai continuar ser corno,0,1,Coitado do miqueinha levando chifre 🤟🫎🫎🫎🤘🤘🤘a muito tempo e não percebeu e vai continuar ser corno,0.62169385,0.11306381225585938,0.5972042,0.34938923,0.10221587,0.62169385,comentarios_misoginia,0,final_misoginia
comentario_2048188,Perdoa Mokeinha🤡 ela agiu por impulso🐮,0,1,Perdoa Mokeinha🤡 ela agiu por impulso🐮,0.06025757,0.10389423370361328,0.06025757,0.0020503998,0.0035517942,0.031917825,comentarios_misoginia,0,final_misoginia
comentario_54450,OXI! VC PODE AMAR E DAR O PIRIKITO PIADA DA PORRA....,0,1,OXI! VC PODE AMAR E DAR O PIRIKITO PIADA DA PORRA....,0.6491204,0.13474011421203613,0.6491204,0.16960317,0.021183543,0.39297962,comentarios_misoginia,0,final_misoginia
comentario_216968,Fake... foca em mostrar mulheres pilantras que essa é sua praia.,1,1,Fake... foca em mostrar mulheres pilantras que essa é sua praia.,0.26859093,0.11486077308654785,0.26859093,0.0126394415,0.030949092,0.24903896,comentarios_misoginia,1,final_misoginia
comentario_1675386,"Boa noite Dom sandro, acredito que o caso da Russia seja diferente, eles não querem feminismo por lá.",0,0,"Boa noite Dom sandro, acredito que o caso da Russia seja diferente, eles não querem feminismo por lá.",0.18705739,0.11206459999084473,0.15435068,0.00459671,0.18705739,0.04090862,comentarios_misoginia,0,final_misoginia
comentario_1031395,Concordo plenamente...sem noção,0,0,Concordo plenamente...sem noção,0.0665887,0.09036684036254883,0.0665887,0.00089645386,0.0012394282,0.03522326,comentarios_misoginia,0,final_misoginia
comentario_2956079,900  Reais não paga nem metade do meu aluguel,0,0,900  Reais não paga nem metade do meu aluguel,0.00719407,0.11680746078491211,0.00719407,0.0004172325,0.00088794855,0.0068098716,comentarios_misoginia,0,final_misoginia
comentario_1782216,Mulher com filho…. Nem de graça,1,1,Mulher com filho…. Nem de graça,0.15269235,0.1210329532623291,0.15269235,0.009994507,0.07177465,0.071116626,comentarios_misoginia,1,final_misoginia
comentario_636890,Mau ela sabe que é somente pó da terra tudo isso acaba e daqui a 100 anos não se tem mais lembranças,0,0,Mau ela sabe que é somente pó da terra tudo isso acaba e daqui a 100 anos não se tem mais lembranças,0.058737632,0.07650327682495117,0.058737632,0.0017166138,0.002830336,0.031146556,comentarios_misoginia,0,final_misoginia
